id,parent_id,created,subreddit,body,author,author_fullname,ups,downs,api_source
h74alzv,t1_h73ksuu,2021-07-30 19:26:28,science,"I reported my boss to HR and a few weeks later I was let go. So much for that ""no retaliation"" thing.",johnny_johnny_johnny,t2_jm0og,5,0,reddit2
h75uv1e,t1_h74l5y7,2021-07-31 03:04:59,science,I will never unsee this.,_Monotropa_Uniflora_,t2_zw6cwpa,1,0,reddit2
h73u7o6,t1_h73phy3,2021-07-30 17:30:08,science,Hmm you and I may work at the same company,Anders13,t2_eil7n,2,0,reddit2
h74g8tu,t1_h73natd,2021-07-30 20:05:43,science,Same.,aerialviews007,t2_11n91q,4,0,reddit2
h74gkxd,t1_h73tkno,2021-07-30 20:08:08,science,"Is it a definition issue, or is it more about what or who would enforce this accountability for employers? There are guides and resources to defining standards that organizations should be held accountable for, but there is very little incentive (speaking from a US perspective). Labor unions, for example, provide both the expectations and the incentive through collective bargaining. 

I don't think that good working conditions are super subjective, but they do require effort and resources from the part of capital owners in a capitalist system, which is at odds with the goal of gaining more capital.",WindDrake,t2_5r7w6,1,0,reddit2
h747ui8,t1_h73sc5h,2021-07-30 19:06:36,science,"I mean, it's not an internet thing or generic. It's widely used and used in contexts of socialism factors that have negative effects.

So what do you hate about it?",WindDrake,t2_5r7w6,5,0,reddit2
h748coz,t1_h73ruh1,2021-07-30 19:10:14,science,...where are they gonna work?,WindDrake,t2_5r7w6,1,0,reddit2
h73wzqm,t1_h73mt8v,2021-07-30 17:49:57,science,"They're looking actual data for a phenomenon that most people know of, it's pretty standard to use the term you are looking to define when describing the research.",totallynotliamneeson,t2_lagrg,6,0,reddit2
h748hmn,t1_h73mt8v,2021-07-30 19:11:14,science,Please explain.,WindDrake,t2_5r7w6,2,0,reddit2
h73vkyp,t1_h73svid,2021-07-30 17:39:54,science,What kind of science are you looking for? I'm sure there are more specific subs dedicated to more specific topics.,writemaddness,t2_6mokovul,2,0,reddit2
h74gwp7,t1_h747ik6,2021-07-30 20:10:28,science,How else do you build awareness about the problem?,WindDrake,t2_5r7w6,1,0,reddit2
h74hmzy,t1_h747o8p,2021-07-30 20:15:36,science,"There should be accountability of some kind, but why it doesn't happen in the US is because that would be breaking the one original sin: tampering with the free market. 

If the US government has proven to be consistent on anything it's that they really don't like to hold corporations accountable, likely because it would effect those corporations profits.",WindDrake,t2_5r7w6,3,0,reddit2
h74htwy,t1_h749b75,2021-07-30 20:16:57,science,Evidence is the first step to reform.,WindDrake,t2_5r7w6,1,0,reddit2
h74i7o3,t1_h749pck,2021-07-30 20:19:41,science,Of course they won't. But it's a tool for people fighting for change.,WindDrake,t2_5r7w6,1,0,reddit2
h74irqf,t1_h74bhj1,2021-07-30 20:23:34,science,"Yes, this is a general conclusion based on the data from the study, and should not be taken literally for any given case (which applies to basically any study in social sciences).

The study is showing that there is an empirical evidence of that linkage and an estimate of the effect.",WindDrake,t2_5r7w6,1,0,reddit2
h74dr3p,t1_h74dq13,2021-07-30 19:48:05,science,"Water is actually not wet; It makes other materials/objects wet. Wetness is the state of a non-liquid when a liquid adheres to, and/or permeates its substance while maintaining chemically distinct structures. So if we say something is wet we mean the liquid is sticking to the object.",WaterIsWetBot,t2_bxn03aek,2,0,reddit2
h74iut7,t1_h74duc0,2021-07-30 20:24:11,science,What?,WindDrake,t2_5r7w6,1,0,reddit2
h74lfnd,t1_h74gusg,2021-07-30 20:42:44,science,"I'm right there with you. Your story could have been mine.

Especially the part about enjoying things again. My last job made me so grumpy it didn't only effect me, but my wife as well.  One year after quitting that terrible job and not only my blood pressure went down, but my wife's as well.",Gibbons74,t2_15tggs,68,0,reddit2
h76zoxm,t1_h74gusg,2021-07-31 12:01:19,science,"Now, let me ask you, was it the work itself or the boss?",windyisle,t2_4ix1b,2,0,reddit2
h786yrs,t1_h773k9k,2021-07-31 18:16:41,science,"One thing I’ve learned, i have tons of coworkers I miss as well. But I’ve seen people blind to bad circumstances because they enjoyed the company of the people that much. Self worth isn’t a scaled measure that companies value or use, but it is such a critical part of being happy where you are without being subject to unfairness.",shlammysammy,t2_3akw4thg,3,0,reddit2
h75n44x,t1_h74xq18,2021-07-31 01:53:39,science,"This is exactly how I’m feeling. A year out, and some things are better… but I’m also still messed up. I get anxious easily, especially if it’s something where I’m being “evaluated,” which encompasses a shocking amount of normal life. Even when something goes really well, I feel like it’s dumb luck or it’s only a matter of time before it goes wrong and everyone hates me.

All that from a stupid job.",Crocopotamus,t2_bwsig,108,0,reddit2
h75pde5,t1_h74xq18,2021-07-31 02:13:46,science,"It may be for a while, but as someone who felt the same for over 8 years now... It can get better, open up to people you can trust, if that's no one, find a good therapist (keep looking if they don't fit you) and just... Talk.",PureGoldX58,t2_f13yt,19,0,reddit2
h75jwvv,t1_h74xq18,2021-07-31 01:25:06,science,Hm it felt for me the same but I truly hope and believe that I can recover..,b2q,t2_l5q4v,11,0,reddit2
h76gk24,t1_h74xq18,2021-07-31 07:15:14,science,"One of my worries about it is that I will never be able to truly let my coworkers in anymore. Place I was in before destroyed every sense I had of coworkers being able to be relied on and I just. Haven't entirely let my guard down since. There are some folks I get along with, sure. But I've never felt they were beyond coworkers I get along with. Seeing these folks who hang out with coworkers after work and the like just doesn't make sense anymore. And while I have that perspective, I remember doing Thanksgiving with some of my coworkers, and just feel conflicted. The question that haunts me is if the sense of equilibrium I have now in life, is truly worth the side of myself I had to give up. I liked being able to trust people. But it's way too hard to do now.",blexmer1,t2_11eag2,1,0,reddit2
h75unn8,t1_h74xq18,2021-07-31 03:03:02,science,I feel that in my soul. I’m sorry you’re going through it also.,sharpcheddar3,t2_t2pry,1,0,reddit2
h761rsl,t1_h74xq18,2021-07-31 04:13:29,science,"Damn that hit home.

Why are some people so obnoxious they ruin the lives of others.",ThanklessTask,t2_59twb,1,0,reddit2
h75m060,t1_h7530mf,2021-07-31 01:43:50,science,"It does wonders for anxiety, in general.",SouthernSmoke,t2_53xot,37,0,reddit2
h75r40o,t1_h7530mf,2021-07-31 02:29:48,science,[deleted],,,35,0,reddit2
h75sdnt,t1_h7530mf,2021-07-31 02:41:31,science,This is what I was able to do. I had 3 months worth of expected expenses in savings. It suddenly occurred to me when I was at my wit's end that I could walk away and I'd be okay.,Undead_Assassin,t2_cjxzz,3,0,reddit2
h75wi2o,t1_h7530mf,2021-07-31 03:20:43,science,"Retired now, but over the years my job responsibilities were incredibly stressful and there were days I really didn’t think I’d make it.  But once I knew I qualified to receive my retirement pension, I suddenly developed a FU attitude, I no longer had to kiss ass, and, I told my bosses how I really felt about their petty games they held over people.  I worked another five years before retiring, but knew I could say FU and walk out the door any time without worrying of being fired was the best feeling in the world.",wyoflyboy68,t2_66wnmfxy,2,0,reddit2
h768y9u,t1_h7530mf,2021-07-31 05:34:33,science,Living cheaply can get you closer to an easy walk too. I'm doing this now. I'm definitely more care free.,kal0kag0thia,t2_4k2tg739,2,0,reddit2
h762839,t1_h75qelg,2021-07-31 04:18:13,science,"This is a good story, and in the past year I've met so many nice people, I can see it being better in time. Just a lot of time...",ThanklessTask,t2_59twb,2,0,reddit2
h763gdt,t1_h75nn11,2021-07-31 04:31:19,science,Smart move.,ThanklessTask,t2_59twb,1,0,reddit2
h763ax4,t1_h75ofpw,2021-07-31 04:29:43,science,I'm learning this the hard way..,ThanklessTask,t2_59twb,3,0,reddit2
h7623u3,t1_h75p7jp,2021-07-31 04:16:57,science,I think that's it isn't it. You give it all and when you surface you realise it's made life's challenges into crisis after crisis.,ThanklessTask,t2_59twb,3,0,reddit2
h7635qg,t1_h75z5r7,2021-07-31 04:28:08,science,Be strong. People out there are nice.,ThanklessTask,t2_59twb,1,0,reddit2
h762vv8,t1_h75ye7w,2021-07-31 04:25:13,science,"Good tale, and glad you're moving on. I still get reflective moments many times.",ThanklessTask,t2_59twb,2,0,reddit2
h762jg6,t1_h75iyos,2021-07-31 04:21:32,science,"Eight years. I gave it everything, built great teams and a great product. The management will get rich off what the team created.

Many have left following my departure.

They made me redundant at the start of covid, I'm late forties and didn't do external training while I focused on the business. I've struggled to find work, and continue to fear being fired and losing everything I've built with the family (which isn't much in fairness).",ThanklessTask,t2_59twb,3,0,reddit2
h762m9d,t1_h75rlvo,2021-07-31 04:22:20,science,"New one isn't toxic, but the feeling of inadequacy is in me and I can't shake it. Maybe in time.",ThanklessTask,t2_59twb,1,0,reddit2
h767902,t1_h763uu1,2021-07-31 05:14:22,science,"A few jobs back when I was younger I had a job briefly (6 months) that was pretty grim.

My step dad gave me this advice, which you can take or leave in the context of this thread...

""So long as they're paying you, take their money.""

Not sure I agree, but in some ways he was very right, so long as you're not in harm's way.",ThanklessTask,t2_59twb,2,0,reddit2
h762q12,t1_h75v10x,2021-07-31 04:23:27,science,"I look back and so many good things. But yes, I am on the whole glad I did.

When you sit out the back of the house looking up suicide help lines you know it's time to leave...",ThanklessTask,t2_59twb,1,0,reddit2
h7637sn,t1_h75ziji,2021-07-31 04:28:46,science,Dunno. I take every day one at a time at the moment.,ThanklessTask,t2_59twb,2,0,reddit2
h76hpry,t1_h76ac22,2021-07-31 07:31:35,science,Good words. Thankyou.,ThanklessTask,t2_59twb,1,0,reddit2
h751aig,t1_h74xb6l,2021-07-30 22:44:47,science,"Take a chance in something you love, friend. 10 years here before I took a chance at a low voltage job. The food industry sucks and you deserve better. Best of luck friend, and don't forget you rock.",LivingDead_Victim,t2_t5ukc,113,0,reddit2
h76ccww,t1_h74xb6l,2021-07-31 06:17:54,science,"I quit my bartending job 4 weeks ago and haven't been able to convince myself to apply for another job. I'm basically considering how long I can deplete and live off my savings in order to gain my mental health back. I was saving for a house, and now I'm using that money to buy back my brain.",Ch3wbacca1,t2_63ru6,3,0,reddit2
h75sitl,t1_h74xb6l,2021-07-31 02:42:51,science,I feel that.,FunGuy0622,t2_3nbd5ryn,1,0,reddit2
h766gjn,t1_h74xb6l,2021-07-31 05:05:04,science,So it’s not just me? I wanna just leave my phone and start walking and never look back.,tedfundy,t2_ap05d,1,0,reddit2
h75guna,t1_h74n0il,2021-07-31 00:58:08,science,"Yeah, that kind of dynamic usually doesn't work. Like my job has a big work party every year with alcohol for an office of a few hundred people. Inevitably people get drunk and blurt out overly truthful or personal stuff, sleep with each other, make an ass of themselves, etc. There is obviously fallout afterwards because half the people in the office are gossipers. 

I think the worst of this mentality is when there are meetings and you have to sit in a circle and toss a ball around that has personal questions like ""do you have kids?"" or ""Where did you grow up?"" are on it. I personally don't feel comfortable talking about my life to other people who are functionally strangers, but you are made to feel like a wet blanket or not a team player if you don't go along with it all.",,,51,0,reddit2
h74q8wz,t1_h74n0il,2021-07-30 21:17:17,science,It works pretty well at my job but I’d definitely agree that a lot of companies just use it to lure people in and hide the toxicity.,rich519,t2_30jix7no,56,0,reddit2
h74tsi3,t1_h74n0il,2021-07-30 21:44:36,science,"Wow, love this comment. My boss kept saying this over and over again and I just quit to get away from her abuse. Makes me worry about her real family if she’s sincere.",,,21,0,reddit2
h75i5x9,t1_h74n0il,2021-07-31 01:09:44,science,Only place the “family” setting works is at a summer camp. Only because your coworkers are the only people your gonna see for the whole summer along with Campers,moonsheeper,t2_456c4wpg,10,0,reddit2
h75cn75,t1_h74n0il,2021-07-31 00:21:17,science,"EXACTLY! I barely have any time for my real friends and family. 


My buddy at work was like why don't we hang out more? I'm like, I see you majority of the week, I probably spend more time with you than my partner. 


I just need a functioning, socially-cordial, stress-free work environment. I don't need any more bff's.",Not_Helping,t2_54j51,8,0,reddit2
h75j16o,t1_h74n0il,2021-07-31 01:17:24,science,"This was exact experience with my last job. Finally found one after 18 months of unemployment. Was stoked to get interviewed, and immediately could tell that something felt off. They were too eager to hire me. But I needed the money so I took it. These people treated me like a therapist. Pushing my buttons to try and get me to open up. They acted like children around me, just cause I was a couple of years older. Then I noticed that they started playing music to put me into a mood so it was easier to connect. These fucks sucked the life out of me. They quite literally went for my emotional core. They had no respect for privacy or boundaries. 1 month in and I tried to hang myself with my bathrobe cord around a doorknob. I'm not kidding, it was awful. Never before was it that bad in my 15 years of odd jobs.",andaleo,t2_nl8m3,1,0,reddit2
h764gsd,t1_h75g1b9,2021-07-31 04:42:26,science,Good for you!!!,Known_Appeal_6370,t2_a13v23b9,2,0,reddit2
h764el9,t1_h75ihjq,2021-07-31 04:41:46,science,Because I've worked there too ;),Known_Appeal_6370,t2_a13v23b9,2,0,reddit2
h770mvh,t1_h752spx,2021-07-31 12:12:56,science,"It's everywhere, isn't it?",Known_Appeal_6370,t2_a13v23b9,1,0,reddit2
h73wtyq,t1_h73rqt6,2021-07-30 17:48:49,science,Social events like luncheon/cookout can either be super performative and annoying or fun and bonding. Any time a job has brought in catering/food trucks it's always the worst lunch of my life. But every time some coworkers organized a simple potluck (usually without involving managers) for someone's going away party it was a great time.,salamat_engot,t2_7mgdf,344,0,reddit2
h7440ef,t1_h73rqt6,2021-07-30 18:39:59,science,"For me it's a big deal when the social event occurs. If we all get some extra time off work to relax during business hours, great! I'm down. If I have to show up on my own time, time I would normally spend on whatever I wanted, hell no. Zero interest.",thePurpleAvenger,t2_s7gob,104,0,reddit2
h73vjom,t1_h73rqt6,2021-07-30 17:39:40,science,I mean the cost of doing a company picnic is peanuts compared to sweeping raises.,BotJovi35,t2_wbi5m,105,0,reddit2
h74lewm,t1_h73rqt6,2021-07-30 20:42:35,science,"When I worked in an office, after my first year I just opted out of offixe secret Santa.

Not everyone knew everyone well enough so we'd sign up in a list with our interests. It turns into buy a $20 gift card just to get $20 back, so I'll just keep my money and skip the awkward opening in front of everyone.",jackospades88,t2_ale5t,22,0,reddit2
h73wiy9,t1_h73rqt6,2021-07-30 17:46:38,science,Ice cream sandwichs!!!!,threebillion6,t2_16qeu0,41,0,reddit2
h74hdba,t1_h73rqt6,2021-07-30 20:13:44,science,"The wage stagnation is crazy. I've been in my company for almost 2 years now, moved positions, responsibilities have increased by magnitudes...and no wage increase. No raise. Never. 

""Oh the pandemic."" I'm in FinTech. We flourished in the pandemic.",Soccermom233,t2_50l5z,5,0,reddit2
h74zjau,t1_h73rqt6,2021-07-30 22:30:23,science,My old work tried to mimic other better companies. Hung motivational posters around and tried to implement things to help moral. No pay rises though.. The things people actually want.,BenoNZ,t2_4ju2w,4,0,reddit2
h73tsib,t1_h73rqt6,2021-07-30 17:27:07,science,"I’ve always felt the same, I never attend any food work events because I’d rather have the money than spend more time with the same human animals I see everyday.",McLounge,t2_12beba,39,0,reddit2
h74q9ri,t1_h73rqt6,2021-07-30 21:17:28,science,How dare you be unhappy with your ice cream sandwich!,AggravatingInstance7,t2_7wf7uvri,3,0,reddit2
h73zq5r,t1_h73rqt6,2021-07-30 18:09:47,science,[deleted],,,6,0,reddit2
h741eji,t1_h73rqt6,2021-07-30 18:21:52,science,All of my best company social events management wasn’t invited.,iDownvoteToxicLeague,t2_3i4v5t8,2,0,reddit2
h73wmb9,t1_h73rqt6,2021-07-30 17:47:19,science,The cost of those 2 things is very different though.  Catering a cookout with some games is probably $100/head.  $100/head/year raise is $2 per week...  I don't think it's gratuitous to do a couple of gatherings a year,DrDragun,t2_55lef,6,0,reddit2
h749f36,t1_h73rqt6,2021-07-30 19:17:58,science,"I’m the same way, how about you take all the money you waste throwing us BBQs twice a month for hundreds of people and stick it in our pockets? I can grill some cheap burgers when I get home, thank you.

It feels condescending for some reason to me.",RedTheDopeKing,t2_6v250,1,0,reddit2
h74dedn,t1_h73rqt6,2021-07-30 19:45:34,science,Ever think that raising wages during a pandemic was probably not a prudent decision?  Were they having record sales or growth to justify it?,MrF_lawblog,t2_50ij79c2,-4,0,reddit2
h73tmev,t1_h73rqt6,2021-07-30 17:25:54,science,[deleted],,,-15,0,reddit2
h74grl3,t1_h73rqt6,2021-07-30 20:09:28,science,"Where do you work and what is your role? 

I like social events because they give me an opportunity to network and get to know the people that I spend all day with a little better. Better work relationships make work more fun and they make me better at my job. We have them occasionally at my workplace and I wish we had more.",,,1,0,reddit2
h74qcqx,t1_h73rqt6,2021-07-30 21:18:07,science,I’m not huge on after work stuff but I do really like the little events my company throws sometimes during work hours. It actually feels like a real reward/celebration/acknowledgement when you get to do it on the clock.,One_Huge_Skittle,t2_93dhf,1,0,reddit2
h74v70p,t1_h73rqt6,2021-07-30 21:55:31,science,"Im okay with social events. As long as they arent used instead of actual pay. Nothing worse than working understaffed for months, only to get a slice of pizza, and the expectation this will make up for everything.",thomasrat1,t2_11g7aj,1,0,reddit2
h756zpd,t1_h73rqt6,2021-07-30 23:32:17,science,My workplace used to do “holiday” parties. Just randomly one year we stopped for no reason that was given. Maybe my boss was embarrassed we all break the alcohol rule right away. Not our fault you take us to a place that will serve alcohol.,,,1,0,reddit2
h75kl5h,t1_h73rqt6,2021-07-31 01:31:12,science,I dont want a happy hour. I dont want tickets to a sporting event. I can't pay my mortgage with those.,gitismatt,t2_bbhua,1,0,reddit2
h73xddj,t1_h73vnu6,2021-07-30 17:52:37,science,"I run a CNC machining center (turning and milling) and a CNC vertical mill. I began doing assembly in late 2009, and got trained on machines in 2010, and learned as much as possible since then. I still wouldn't call myself a machinist though. I don't have much experience on manual machine tools.",chillford-brimley,t2_jkxjg2p,20,0,reddit2
h74j9ez,t1_h74cmmf,2021-07-30 20:27:03,science,"Absolutely. I bought custom molded plugs years ago. I wear them all shift, even though the time weighted average is below the OSHA threshold.",chillford-brimley,t2_jkxjg2p,8,0,reddit2
h7444df,t1_h73zn3k,2021-07-30 18:40:19,science,"Wow, I never knew that was possible. Even temporarily. A dollar raise per PAYMENT? That must really incentivize you.",sedulouspellucidsoft,t2_17fc96,1,0,reddit2
h7700lf,t1_h7565e5,2021-07-31 12:05:20,science,"I do production, so it's little more than load stock, load program, set a few things on control, run, measurements, repeat. There ar some setups I run that are a little more involved. I've been staring at similar parts with similar dimensions, I have many measurements memorized by part number. For some people this sameness is a beautiful thing, and we thrive doing repetitive work.",chillford-brimley,t2_jkxjg2p,1,0,reddit2
h75w0w6,t1_h75uc3m,2021-07-31 03:16:05,science,That’s rough. Take care of yourself any way you can. Cut yourself some slack anywhere you can. Grad school is a motherfucker.,ellivibrutp,t2_7nfkx,3,0,reddit2
h75t16q,t1_h75m67y,2021-07-31 02:47:39,science,"That’s part of what I’m saying. These kinds of jobs drain so much physical and emotional energy that it makes it hard to leave. No shame in getting outside help or encouragement, whether it’s a friend, family, or therapist, to make a change.",ellivibrutp,t2_7nfkx,2,0,reddit2
h73u0ia,t1_h73s0wa,2021-07-30 17:28:43,science,Where can I find that documentary?,aBABYrabbit,t2_70d12,47,0,reddit2
h74g9gu,t1_h73s0wa,2021-07-30 20:05:51,science,"I have all those symptoms. In addition to the guilt because I shouldn't be miserable because it's not *that bad* compared to the homeless or whatever, but I still am. I feel claustrophobic",irishking44,t2_jmp62,45,0,reddit2
h74fald,t1_h73s0wa,2021-07-30 19:59:00,science,"u/Nervous_Tennis1843 I love your comment. A lot of people talk about the lack of competitive salaries as a reason for the brain drain that France experiences among its highly skilled workforce despite the social benefits but as someone who chose to immigrate to France, the toxic work environment aspect is a real driver for brain drain as well. I can count at least 5 French people in my small entourage who have left companies or even just went to work in other countries because they refused to tolerate the work environment anymore. I'm currently looking for work for next spring after my degree and the work atmosphere is a top priority for me.",nomadicfille,t2_ginj0,15,0,reddit2
h7593cx,t1_h73s0wa,2021-07-30 23:50:22,science,[removed],,,9,0,reddit2
h75gv7k,t1_h73s0wa,2021-07-31 00:58:16,science,Scary how close this hits home. From one toxic environment onto another it isn’t surprising that I ended up inpatient.,ForgottenDreams,t2_9vn7c,3,0,reddit2
h73nobl,t1_h73izk4,2021-07-30 16:44:01,science,"Instead, by that point, we'll be looking at the mental harm caused by mass unemployment in our current economic system.


If nothing changes and lots of people are without jobs due to automation... what happens?


That's going to be a pretty daunting thing to overcome.",Artemis_Hunter,t2_85evl,35,0,reddit2
h73zkgw,t1_h73izk4,2021-07-30 18:08:37,science,"Computer programmers, designers, copy writers, can all be worked in sweatshop conditions too. Labor conditions are independent of skills or jobs. Musicians like avicii kill themselves over how they're worked, the screen actors guild exists because actors weren't treated well.",sparung1979,t2_2ear9uxr,17,0,reddit2
h746o1j,t1_h73izk4,2021-07-30 18:58:12,science,"I'm pretty sure its possible to burn out from any job with enough stress.  I was probably pretty close as a game tester and all I did was write bug reports and check boxes on a form, but I did it for 65 hours a week for almost 9 months straight.  Devs have an insane burnout rate.  You're not going to automate software dev any time soon.",LigerZeroSchneider,t2_fcom8,5,0,reddit2
h748nlf,t1_h73izk4,2021-07-30 19:12:25,science,"My most traumatic work environments were in tech and academic research. White collar workers can be abused by their employers, too.",bloodandkoolaid,t2_8vt1h,5,0,reddit2
h740yzu,t1_h73wmit,2021-07-30 18:18:49,science,Well I download them from the sd cards. I work in an office. But I do download a few from our Dallas branch. I also shoot a wedding a weekend For them. They count that as contract work so I don't get overtime or anything. I work 7 days a week.,Undervaluedsticks,t2_160os7,19,0,reddit2
h74156p,t1_h73wmit,2021-07-30 18:20:03,science,But yes its a single company. We do 1200 weddings a year. I edit 4 Videos a week.,Undervaluedsticks,t2_160os7,7,0,reddit2
h77k8k3,t1_h75arjf,2021-07-31 15:15:20,science,She's going to a nice school. Its half paid for by her scholarship. But the other half we try to pay to not take loans. She just took more loans so I can look for another job actually. She's awesome.,Undervaluedsticks,t2_160os7,2,0,reddit2
h77k2op,t1_h75fqyc,2021-07-31 15:13:59,science,">uitting and starting your own thing?

Yes, But I have signed a no compete with this company for shooting. I can edit though. the no compete if for two years. I would honestly break it though. If I found the clients.",Undervaluedsticks,t2_160os7,1,0,reddit2
h74b8dp,t1_h73htdr,2021-07-30 19:29:45,science,I would also like to say hello.,CNXQDRFS,t2_gmmut,16,0,reddit2
h74h4qt,t1_h742hus,2021-07-30 20:12:03,science,"Bad managers are useless, middle management is not inherently useless.",,,62,0,reddit2
