id,parent_id,created,subreddit,body,author,author_fullname,ups,downs,api_source
h77esv1,t1_h755zdh,2021-07-31 14:31:00,science,That's not true at all. Their job is to provide direction based on the strategy handed down from their boss. If everyone just reported to the VP it would be chaos.,,,0,0,reddit2
h74r0na,t1_h74hdbd,2021-07-30 21:23:09,science,I swear there's either a cognitive block or some buisness major class that makes a dollar/hr raise less desirable than 5/hr in other expenses.,This_is_my_phone_tho,t2_11me4n,6,0,reddit2
h74id57,t1_h74hdbd,2021-07-30 20:20:44,science,But it could be more expensive or cost time to train up to a replacement senior level subject matter expert. Managers have much more generalized skillsets. It's pretty common in the IT field to have seniors and leads who have decades of experience and a manager above them who is younger and less experienced.,vessol,t2_7x1me,2,0,reddit2
h740zmi,t1_h73wr10,2021-07-30 18:18:57,science,Shop that job anyways. Job titles are almost pointless. It is the job duties and responsibilities that matter more on your resume.,Hugh_Jass_Clouds,t2_l5bwf,24,0,reddit2
h743c17,t1_h73wr10,2021-07-30 18:35:51,science,"Also keep in mind golden handcuffs - if they keep giving you $$ but no title, it can be a tough sell to get someone else (who hasn’t seen your work day in and day out) to match it. 

Shop around now!!!!",rcher87,t2_bbarmb,6,0,reddit2
h74nsye,t1_h73wr10,2021-07-30 21:00:07,science,">that I don't kiss asses.

Bingo. If you aren't sucking up you won't get promoted. I had one workplace that had a required training saying to give your accomplishments up as your manager's accomplishments so that they could pull you up when they got promoted.

Corporate work is all about ass kissing and politics. Your abilities rarely if ever matter.",MidNerd,t2_22iayosb,5,0,reddit2
h74hizf,t1_h73wr10,2021-07-30 20:14:50,science,Maybe your personality isn't conducive to managing. Being the best at the job doesn't mean you'll be the best manager.,,,2,0,reddit2
h7580nx,t1_h7576ao,2021-07-30 23:41:05,science,"Target, they are very flexible",Entropy308,t2_rglah,4,0,reddit2
h74q9d7,t1_h748hym,2021-07-30 21:17:23,science,"I think you may have the wrong audience here.

I am fully with you, and avoid D&A like the plague. I had a stint there, and it was miserable. 

But it's hard to complain to someone how little time you have, how stressed out you are, how close you are to just... giving up, when all they see is that you make 4X what they do.

Yeah, sure, but it really doesn't make up for it.

Like, my sister works in a small vacation town as a cook. Makes very little, is unemployed half the year. She looks at what I do with envy, as I make a good living..  I look at her with envy, because I'd give it all up in a heartbeat to not be so stressed out every single moment I'm awake.",,,2,0,reddit2
h7609wh,t1_h748hym,2021-07-31 03:58:10,science,What is D&A?,hacking_graphics,t2_yhpoj,1,0,reddit2
h74036h,t1_h73xfyk,2021-07-30 18:12:24,science,I assumed it was so no one posted anything much worse.,SkyScamall,t2_17beck,1,0,reddit2
h745bdk,t1_h73zu5x,2021-07-30 18:48:38,science,[removed],,,9,0,reddit2
h74ykge,t1_h74y253,2021-07-30 22:22:28,science,Thank you!! This thread has been incredibly therapeutic after a tough final day.,,,1,0,reddit2
h74f1v7,t1_h746syf,2021-07-30 19:57:15,science,"This is why everyone else getting together in a group to deal with these people is necessary, gotta get all the little fish together to eat the big fish",BackThatThangUp,t2_dkdws,7,0,reddit2
h74x3nv,t1_h74752g,2021-07-30 22:10:41,science,"This is the worst thing people say about psychiatric medicine. That you “shouldn’t need it” or that someone is “just on it because of your circumstances” or some other such nonsense depending on the situation. It doesn’t make you any less aware of how intolerable your living situation is, it just keeps you from experiencing the more severe symptoms of mental illness. And it’s very helpful for a lot of people.",Semipr047,t2_172w14,5,0,reddit2
h74b3nj,t1_h74752g,2021-07-30 19:28:46,science,"I mean I more was getting to the point of just quitting the job. If your job sucks, and you hate it there, why stay? Especially in the worker shortage situation we face?",Brodellsky,t2_4zz9l,2,0,reddit2
h7547c8,t1_h74d26w,2021-07-30 23:08:53,science,">Do you think it's legitimately confusing?

>There's more than one way to describe something, especially coloquialy [sic]

If you're going to try your hand at being patronising, you should probably make sure you can spell first.",wjw75,t2_1mtsp,-2,0,reddit2
h7485fr,t1_h7438bk,2021-07-30 19:08:47,science,I ain’t gatekeeping and have no power to do so. I just want a way to filter this stuff as I have no interest in it.,McKnighty9,t2_ru18w,-1,0,reddit2
h74iurz,t1_h74ij6r,2021-07-30 20:24:10,science,Thank you!,McKnighty9,t2_ru18w,1,0,reddit2
h74y8lj,t1_h74kmfd,2021-07-30 22:19:50,science,You can look for a new job before you quit. If you job makes you depressed it only makes sense.,Shockling,t2_91cnw,1,0,reddit2
h75i6de,t1_h75dm5b,2021-07-31 01:09:50,science,This. I have no certifications but was fortunate enough to move from a customer service position to an IT position within my company. I just started two months ago and am already being told I’m going to be promoted. Any IT manager will tell you they prefer experience over certifications.,DadlyDad,t2_pqycl,16,0,reddit2
h754vzn,t1_h753kgh,2021-07-30 23:14:36,science,"Fortunately, I do. Once I get my cert, they have a space for me.  Appreciate the concern.",elmjakv2,t2_6in254we,6,0,reddit2
h75ezrp,t1_h753kgh,2021-07-31 00:42:00,science,This comment wasn't necessary.,seriously__sarcastic,t2_cyjsezt,3,0,reddit2
h75q1lr,t1_h753kgh,2021-07-31 02:20:00,science,"Do you mean you need to know people to work as IT support, or are you referring to the general field of IT like software development or devops?",jrkridichch,t2_16tdie3s,2,0,reddit2
h74tecc,t1_h74sw9s,2021-07-30 21:41:34,science,"Here is my issue with that: you work with someone as an equal for ten years and get drunk with him and you're friends first and co-workers second.  He gets promoted.  He has to tell you that you screwed something up.  You're now getting reprimanded by your drinking buddy.  

That hurts way, way more than if you had kept things professional.  Now it's highly personal.",,,22,0,reddit2
h75ay9l,t1_h74sw9s,2021-07-31 00:06:21,science,Gross I can't be friends with people I work with. Thats like professional incest,abrasaxual,t2_d5txdtv8,3,0,reddit2
h759l7h,t1_h74sw9s,2021-07-30 23:54:38,science,"> Treat your coworkers like family

> Fraternizing in the workplace is forbidden

NervousByttonGuy.gif",RamenJunkie,t2_5zkts,2,0,reddit2
h751r9b,t1_h7478yy,2021-07-30 22:48:32,science,"If it's work related and mandatory, it's on the clock. If it isn't mandatory and isn't on the clock, I'm not attending. If it's going to cost me money to attend, I'm not attending.

I have better things to do with my time.",Lucent_Sable,t2_fhmnz,49,0,reddit2
h74q4md,t1_h7478yy,2021-07-30 21:16:23,science,Yep - I can think of a lot of other things that I could do rather than go to employer-sponsored social functions. Those sorts of things are always awkward and uncomfortable. I imagine that working nights doesn't help things because these things probably are geared towards the schedules of the people who work the daytime hours?,SchuminWeb,t2_5ph5l,12,0,reddit2
h767pjz,t1_h7478yy,2021-07-31 05:19:45,science,Organized fun. Hated it.,,,1,0,reddit2
h754r5r,t1_h74s4ev,2021-07-30 23:13:28,science,Thanks for this. Really insightful. Can you recommend any resources where I could read about workplace theory in more detail? It dominates our lives and the issues fascinate me,jizmatik,t2_1443mr,13,0,reddit2
h751yh1,t1_h74ys1i,2021-07-30 22:50:11,science,"If it's mandatory, it should be on the clock.",Lucent_Sable,t2_fhmnz,16,0,reddit2
h74csjm,t1_h740b2o,2021-07-30 19:41:09,science,Sit on the crapper for an extra 45 minutes.,Mr-Fleshcage,t2_5ygtmccm,27,0,reddit2
h74x9fx,t1_h74c1e3,2021-07-30 22:11:59,science,"For many years we weren't ""employees"", we were FTEs and PTEs.  Full-time equivalents and part-time equivalents.

Like interchangeable widgets.",Gruesome,t2_o7yl,3,0,reddit2
h74e8xe,t1_h740cej,2021-07-30 19:51:35,science,"We did one of those coin drop things where a coin is frozen in an ice statue, and you write down the time you predict it will fall out. I won it, but they wanted to redo it as a random draw because it was too early and not enough people had shown up yet. I'm still salty i didn't get the company points equivalent of $15.",Mr-Fleshcage,t2_5ygtmccm,19,0,reddit2
h74tspk,t1_h740cej,2021-07-30 21:44:39,science,Exactly. Take that money and turn it into a  Christmas bonus and leave everyone smiling.,SchuminWeb,t2_5ph5l,2,0,reddit2
h75fyqd,t1_h75ery1,2021-07-31 00:50:29,science,Why bottled water?,patkgreen,t2_5wwwh,2,0,reddit2
h742g17,t1_h740cbk,2021-07-30 18:29:21,science,This is an interesting debate I’d like to see hashed out. Is despising the people you work with healthy or not?,sedulouspellucidsoft,t2_17fc96,14,0,reddit2
h74rvqa,t1_h740cbk,2021-07-30 21:29:50,science,"you totally missed the point.

i'd tell you to try thinking about it again but you are making it very clear it doesn't concern you.",grepe,t2_4hpyi,2,0,reddit2
h742cjg,t1_h741e92,2021-07-30 18:28:38,science,[deleted],,,-2,0,reddit2
h745oeo,t1_h745m60,2021-07-30 18:51:10,science,Maybe that’s the problem.,Septic-Mist,t2_15i6gf7n,2,0,reddit2
h74j32o,t1_h74i5i7,2021-07-30 20:25:48,science,You know that I don't know where they work or what industry they're in. Did you know when making the assertion that OP's company is one of the failing ones?,PegasusAssistant,t2_xbp9b,1,0,reddit2
h7514ri,t1_h74wn02,2021-07-30 22:43:28,science,How is most of your programming done? Is it from cad/cam models and you work with the designers or are you doing more basic operations you manually program?,BenoNZ,t2_4ju2w,3,0,reddit2
h7eyq0e,t1_h7abdei,2021-08-02 10:48:03,science,Yes. Not every busness is stupid enough to think nickel and dime raises keep people.,Hugh_Jass_Clouds,t2_l5bwf,1,0,reddit2
h74045u,t1_h73wb6t,2021-07-30 18:12:36,science,"At the risk of sounding impertinent, you don't know the future any more than I do and I was a weather forecaster for 10 years. Why be cynical about a future that hasn't happened yet? Be realistic but optimistic at the same time. 

Personally, I'm cynically optimistic about the future. Skeptical about people making it happen but optimistic we will get there in the end.",CynicalCheer,t2_14qe5pua,8,0,reddit2
h73xqma,t1_h73wb6t,2021-07-30 17:55:16,science,"Don't given to hopelessness, because when it comes down to it these things must be fought for.",thegamenerd,t2_e21xo,9,0,reddit2
h73xnr5,t1_h73wb6t,2021-07-30 17:54:41,science,"There are not enough resources for post scarcity anything with the number of people we have. Most of everything is becoming more scarce, not less.",HIITMAN69,t2_2nqkseey,-4,0,reddit2
h74spyy,t1_h74fjzc,2021-07-30 21:36:21,science,"The night is always darkest just before the dawn.

Automation will be Gandalf at Helm’s Deep",SoundandFurySNothing,t2_615if,2,0,reddit2
h78xx8t,t1_h77kbvb,2021-07-31 22:03:05,science,"They won't, but you won't find out until you try.

And on the off chance they're stupid enough to do so, so what, it's an opportunity to get a better salary.

You're being exploited.

You only live once.",zepolen,t2_17x43,1,0,reddit2
hjw8jep,t1_h74ta0e,2021-11-09 03:58:08,science,Post your services on Craigslist?,,,1,0,reddit2
h750dz4,t1_h74ykge,2021-07-30 22:37:23,science,Time to kick up your feet and have a relaxing beverage of your choice! :),nyoomachine,t2_kaepp,2,0,reddit2
h75ro44,t1_h74x3nv,2021-07-31 02:34:55,science,"No, I think you got the wrong message from that. I was more going for the later half, the part about what we aren’t doing much else to prevent or assist with these issues.

I have been on SSRIs myself and also been on quite a wide assortment of prescribed and/or self-medicated pharma trying to fill a void that couldn’t be filled, pass the time and deal with boredom, to forget and go forth - mental disease is a major bummer and while I mean what I said, I didn’t mean for it to extend to such things as needing or not needing it but rather, “that’s the best we can do”. If that works for you, more power to ya.

There are worlds of other things outside just prescription pickup that I think are more important that we aren’t doing and it shows.",Nicktendo13,t2_di2sn,3,0,reddit2
h75jbl8,t1_h74x3nv,2021-07-31 01:19:56,science,"Pretty much, thank you. I needed the SSRI before the job, the job just reminded me how much I do. I'm not taking it for my job, I'm taking it for life outside of the job. My situation is still not great, but I can work it out for a better solution instead of the first one that comes to mind. I don't like the idea of being so desperate that I recklessly affect my and my partner's living situation. And now with it, I can think clearly and make more precise decisions, and act more smartly on the social side, instead of burning bridges.",AbeliaGG,t2_s34s0g7,2,0,reddit2
h74g1zs,t1_h7485fr,2021-07-30 20:04:23,science,"That's called ""leave"" or just ""scroll past"".",writemaddness,t2_6mokovul,2,0,reddit2
h750qgv,t1_h74y8lj,2021-07-30 22:40:16,science,"Having time to search for a job is also a luxury.

And that's not even as important as the fact that the idea that companies that treat employees poorly fail is just not true. Would you like to comment on that explanation above?",WindDrake,t2_5r7w6,1,0,reddit2
h75if7w,t1_h75i6de,2021-07-31 01:12:00,science,"Yuuup. I've worked with a bunch of dudes who had certs out the ass, but were just kinda dogshit at actually fixing things.",meinsaft,t2_6mcx6,3,0,reddit2
h76tmh9,t1_h75i6de,2021-07-31 10:36:20,science,The thing about certifications is that the *expire*.,PurpenDickular,t2_4uy1irf9,1,0,reddit2
h755wj2,t1_h754vzn,2021-07-30 23:23:07,science,"A word of advice from someone whose worked in the IT field for almost 5 years so far. Help desk is a very mentally draining job. Be fully prepared for the ticket queue. Projects and deadlines never stop or have a break period. Which isn't bad because I'm paid nicely for my time. The only thing I wish I had thought about was the stress it puts on me mentally. But as others have said. Unless you know someone pushing into the tech industry is extremely hard without creds. But if you like solving problems like I do you learn to manage everything. It's truly a balancing act all on it's own to manage the phones, ticket queue and troubleshooting. Best of wishes! I know you can do it though!!!",,,10,0,reddit2
h75cs6d,t1_h74tecc,2021-07-31 00:22:28,science,"That's a problem with authoritarian command & control structures in the workplace, not with friendships.

If your management structure can't tolerate people becoming friends then it's fundamentally toxic.

Worker-owned democratic workplaces exist, where managers are voted or rotated in, and their jobs are facilitative rather than authoritarian.",Excrubulent,t2_cgy99,10,0,reddit2
h751ubk,t1_h74tecc,2021-07-30 22:49:14,science,"Yeah, that's exactly what happens in the military a lot.",angelrobot13,t2_hkbae,9,0,reddit2
h75jm6h,t1_h74tecc,2021-07-31 01:22:27,science,"This is a struggle I have as a process engineer. I have to find out how mistakes were made and single out the person to retrain (and of course error proof for understandable mistakes that anyone could make), and sometimes you have to be firm because it is occasionally laziness or not listening that is the problem. I also have to have a rapport with them though because my job is to prevent future mistakes, not constantly fix them, and they have to feel comfortable to tell me what they see without being asked even if they messed up. Delicate balance I've not fully figured out yet. I do try my best to remind them I'm not your boss and I don't ever submit a complaint to management unless they are deliberately destroying parts or doing something illegal. Still saying that doesn't guarantee trust, I just have to hope they realize over time that when I'm critical of them word of it never goes beyond the retraining.",latenightwandering,t2_gnmrm,6,0,reddit2
h74qub5,t1_h74q4md,2021-07-30 21:21:48,science,That's exactly right. It just ended up causing me problems on my next shift.,Patchy248,t2_9hm0w,8,0,reddit2
h7554px,t1_h754r5r,2021-07-30 23:16:38,science,The Wikipedia page does a really good job of explaining the fundamentals and noting prominent theories: https://en.m.wikipedia.org/wiki/Work_motivation,ItWasTheGiraffe,t2_9j81t,8,0,reddit2
h759fy2,t1_h751yh1,2021-07-30 23:53:22,science,It should be. But it looks bad if you aren't there. Fortunately it only happens once a year.,Queen_Inappropria,t2_ywhuk,7,0,reddit2
h74d4k9,t1_h74csjm,2021-07-30 19:43:34,science,"Boss makes a dollar, I make a dime, that’s why I poop on company time",edgar__allan__bro,t2_magve,36,0,reddit2
h751zx9,t1_h74csjm,2021-07-30 22:50:31,science,"Fun, but unionisation is lasts even longer if you do it right :)",XihuanNi-6784,t2_12n7mq,2,0,reddit2
h74u0el,t1_h74e8xe,2021-07-30 21:46:20,science,"I'd be salty, too. They promised a prize, and you were the rightful winner, and they reneged on it.",SchuminWeb,t2_5ph5l,16,0,reddit2
h75nxdi,t1_h75fyqd,2021-07-31 02:00:51,science,Because they don't want transmission from COVID-19 but I don't think they know what they're doing.,threebillion6,t2_16qeu0,3,0,reddit2
h74uiho,t1_h742g17,2021-07-30 21:50:13,science,"If they give you reason to despise them, I mean...",SchuminWeb,t2_5ph5l,5,0,reddit2
h742iua,t1_h742cjg,2021-07-30 18:29:55,science,"I don't know, is listening to three to four idiots constantly talk, shout, belch, yawn, ring on their phones or otherwise interrupt me for ~6-7 hours a day healthy?",Abedeus,t2_593a6,13,0,reddit2
h74c0tm,t1_h745oeo,2021-07-30 19:35:32,science,[deleted],,,-2,0,reddit2
h759efq,t1_h7514ri,2021-07-30 23:53:01,science,"Engineering makes a 3D model, programmer uses that to generate the program with a post process specifically for the control and tools I'm running. I do the basic setup and operation. I make edits to feeds and other simper parts of the program, and send the file back upstream for them to put on the server permanently.",chillford-brimley,t2_jkxjg2p,1,0,reddit2
h8br28s,t1_h7eyq0e,2021-08-09 20:06:40,science,I’d be lucky to get a raise every year though,sedulouspellucidsoft,t2_17fc96,1,0,reddit2
h74gvrb,t1_h74045u,2021-07-30 20:10:17,science,Worrying is fantasising in the wrong direction,Ikbeneenpaard,t2_r32f0,6,0,reddit2
h748gh2,t1_h74045u,2021-07-30 19:11:00,science,That’s a nice outlook,sedulouspellucidsoft,t2_17fc96,1,0,reddit2
h7489t8,t1_h73xnr5,2021-07-30 19:09:39,science,"They’re talking about automation, robots creating post-scarcity, as Karl Marx predicted.",sedulouspellucidsoft,t2_17fc96,1,0,reddit2
h75jmej,t1_h75if7w,2021-07-31 01:22:31,science,I really am thankful for all of the advice. Thanks y'all.,elmjakv2,t2_6in254we,4,0,reddit2
h756j7e,t1_h755wj2,2021-07-30 23:28:25,science,"Thanks for the advice. I figure if I can run a bar and all that entails, then I can handle the brain drain. Hopefully my clients won't be actively drunk when I deal with them like they are now.",elmjakv2,t2_6in254we,5,0,reddit2
h75b0we,t1_h751ubk,2021-07-31 00:06:59,science,Yeah and look at how fucked in the head those morons usually are...,abrasaxual,t2_d5txdtv8,5,0,reddit2
h768nj1,t1_h75jm6h,2021-07-31 05:30:58,science,"I do this same thing for AS9100 except every employee in the process has been conditioned to lie, hide their failures and attack politically anybody perceived as above them. It's a complete hopeless toxic nightmare, but it's not my fault management can't be bothered to spend a single red cent on human resource controls. So, I maintain zero relationships and am prepared to walk anytime.",kal0kag0thia,t2_4k2tg739,1,0,reddit2
h757xpf,t1_h7554px,2021-07-30 23:40:24,science,"Gracias amigo, have a pleasant weekend!",jizmatik,t2_1443mr,3,0,reddit2
h76ndpx,t1_h751zx9,2021-07-31 08:57:41,science,"Corporate: We hear you. We're going to hire additional staff so you know we're taking this seriously. 

Also Corporate: You're all fired effective immediately.",MrSaidOutBitch,t2_8x5o7tse,3,0,reddit2
h75smwp,t1_h75nxdi,2021-07-31 02:43:55,science,Fair,patkgreen,t2_5wwwh,2,0,reddit2
h74zqyb,t1_h742iua,2021-07-30 22:32:07,science,We should ask your coworkers.,No-Chemistry-2611,t2_ciwxorq0,3,0,reddit2
h74ctl1,t1_h74c0tm,2021-07-30 19:41:21,science,"The problem is maybe we need to think about and adjust the relationship between companies and their owners so that workers can get paid more. 

You think I’m arguing against you on this?",Septic-Mist,t2_15i6gf7n,2,0,reddit2
h74mrgw,t1_h74c0tm,2021-07-30 20:52:21,science,Bruh nobody asked yours either and yet you responded. It's an open forum.,AtreusFamilyRecipe,t2_4iote5d1,3,0,reddit2
h75b50d,t1_h759efq,2021-07-31 00:07:58,science,"Oh cool, I used to do design and cnc cam programs. What software do you guys use?",BenoNZ,t2_4ju2w,1,0,reddit2
h74c90q,t1_h7489t8,2021-07-30 19:37:12,science,Robots can’t solve resource limitations. Robots will be the victim of resource limitations.,HIITMAN69,t2_2nqkseey,1,0,reddit2
h75jvq9,t1_h75jmej,2021-07-31 01:24:49,science,"You're welcome! I don't say this stuff to devalue education, by the way. Your certs will help you get increasingly better paying jobs. Just make sure you also put that knowledge to practice.",meinsaft,t2_6mcx6,4,0,reddit2
h75b9tm,t1_h756j7e,2021-07-31 00:09:10,science,"I've been in the IT industry for about 20 years, and I also started with an A+. It's a good start, and there are many other areas you can get into. Linux is my love and is something I use for work and at home. Find something you'll love, then build it, break it, and fix it. Above all else, never stop learning. You got this dude!",brnix24,t2_4diely09,6,0,reddit2
h75bsz2,t1_h75b50d,2021-07-31 00:13:50,science,"Solid edge for the modeling, and Esprit for CNC. That's about all I know on that end.",chillford-brimley,t2_jkxjg2p,1,0,reddit2
h74d91v,t1_h74c90q,2021-07-30 19:44:29,science,"We have a lot of resources, we just don’t distribute them efficiently, which robots can help with.",sedulouspellucidsoft,t2_17fc96,1,0,reddit2
h74p9l3,t1_h74d91v,2021-07-30 21:09:47,science,Robots are not going to stop greed and over-exploitation,HIITMAN69,t2_2nqkseey,2,0,reddit2
h74rtzm,t1_h74p9l3,2021-07-30 21:29:27,science,"No, people will have to decide to do that. You can find that unlikely, but it's still the only workable premise to discuss.",gcolquhoun,t2_t65f3,2,0,reddit2
h74yx37,t1_h74p9l3,2021-07-30 22:25:19,science,"That comes from scarcity, we can see direct historical evidence (and mice models) that greed (and exploitation) is less when resources are less scarce. If robots distribute resources efficiently, there will be negligible greed.",sedulouspellucidsoft,t2_17fc96,1,0,reddit2
h74s0lr,t1_h74rtzm,2021-07-30 21:30:53,science,"It’s not going to happen. Post scarcity anything is not going to happen. It goes against psychology, it goes against reality.",HIITMAN69,t2_2nqkseey,2,0,reddit2
h74z7ei,t1_h74yx37,2021-07-30 22:27:40,science,Who decides what is efficient? Any AI capable of making such abstract decisions poses its own potentially existential risks.,HIITMAN69,t2_2nqkseey,1,0,reddit2
h74t11g,t1_h74s0lr,2021-07-30 21:38:41,science,"You may be right, it seems quite likely. However, in the off chance you are wrong, people having conversations about other possibilities is pre-requisite to any other outcome.",gcolquhoun,t2_t65f3,2,0,reddit2
h7535vw,t1_h74z7ei,2021-07-30 23:00:11,science,I’m just talking about availability of resources. Let me know if you had something else in mind.,sedulouspellucidsoft,t2_17fc96,1,0,reddit2
h74z0wz,t1_h74t11g,2021-07-30 22:26:11,science,It seems quite likely that the future will be utopian not dystopian.,sedulouspellucidsoft,t2_17fc96,1,0,reddit2
j18z4cp,t3_zsotdk,2022-12-22 15:33:39,science,"Welcome to r/science! This is a heavily moderated subreddit in order to keep the discussion on science. However, we recognize that many people want to discuss how they feel the research relates to their own personal lives, so to give people a space to do that, **personal anecdotes are allowed as responses to this comment**. Any anecdotal comments elsewhere in the discussion will be removed and our [normal comment rules]( https://www.reddit.com/r/science/wiki/rules#wiki_comment_rules) apply to all other comments.

*I am a bot, and this action was performed automatically. Please [contact the moderators of this subreddit](/message/compose/?to=/r/science) if you have any questions or concerns.*",AutoModerator,t2_6l4z3,1,0,reddit3
j1a35ys,t3_zsotdk,2022-12-22 19:54:32,science,"This must be a joke!

Narcissistic traits were determined by evaluating the CEO's...drum roll please...

""Selfie? (self photo), signature size, and CEO gender""

ARE YOU KIDDING ME?",The_Paleking,t2_zcoiy,218,0,reddit3
j1957f3,t3_zsotdk,2022-12-22 16:14:12,science,Almost makes me think it's not an indication that CEOs are bad but that the system has a fundamental structure which rewards those traits and will actively seek out people who have them and put them into positions of authority.,Particular_Being420,t2_o254bl3c,1136,0,reddit3
j191jxm,t3_zsotdk,2022-12-22 15:49:53,science,"Yeah, I’ve been noticing. 

People assume that if you are confident and aggressive you know what you are doing.",FiendishHawk,t2_6kg0cp5i,345,0,reddit3
j19d7jv,t3_zsotdk,2022-12-22 17:06:13,science,So it's evidence that our economy is the physical manifestation of a personality disorder. Checks out.,brettoseph,t2_kwmjw,113,0,reddit3
