id,parent_id,created,subreddit,body,author,author_fullname,ups,downs,api_source
h7581ed,t3_oujqvq,2021-07-30 23:41:16,science,"Jokes on the author, most workplaces are toxic, as fully displayed by the onset of the pandemic. No one was surprised, almost all corporations are evil and revel in toxic work culture and practices.",versace_tombstone,t2_8st3sn6,1,0,reddit2
h758el1,t3_oujqvq,2021-07-30 23:44:24,science,See: [Gattungswesen](https://en.wikipedia.org/wiki/Marx's_theory_of_human_nature?wprov=sfti1),RedSarc,t2_13ih42,1,0,reddit2
h758eyz,t3_oujqvq,2021-07-30 23:44:30,science,That’s kind of why we get paid.. for doing hard work.,CritiqOfPureBullshit,t2_rgp68,1,0,reddit2
h758l5k,t3_oujqvq,2021-07-30 23:45:58,science,"This is one of those studies that you know innately is true, and now you're relieved to know that it's backed by science",wirecats,t2_s2kmv,1,0,reddit2
h758plw,t3_oujqvq,2021-07-30 23:47:01,science,Nofuckingduh.com another study we didn't need,joeysprezza,t2_5ssyjdep,1,0,reddit2
h759847,t3_oujqvq,2021-07-30 23:51:30,science,"Socialism or barbarism. You cannot rely on capitalists to be ""woke"" it goes against their only interest which is extracting wealth from labor.",doodoowithsprinkles,t2_ac53ata9,1,0,reddit2
h759jld,t3_oujqvq,2021-07-30 23:54:15,science,So every job ivs had in the past 20 years.,Dear-Crow,t2_6hvr3wk3,1,0,reddit2
h759yr4,t3_oujqvq,2021-07-30 23:57:50,science,"Don't fail to consider preference, some people don't like being cross trained or placed in different situations. I get put in the same job each dwyz despite knowing all of the other positions, which is actually fine for me, I know the process of the workplace so I don't feel inadequate compared to my coworkers, but 8bjave the mental comfort of stability. 

Plus, I get to listen to music on my phone, thank God.",Ecstatic-Key-5309,t2_d38rlelz,1,0,reddit2
h75ai8p,t3_oujqvq,2021-07-31 00:02:31,science,"I don't need your congratulations Jeff, I need a Living Wage and some basic health benefits. I would be a lot less depressed for sure.",Henshin05,t2_atb2pbga,1,0,reddit2
h75aqjf,t3_oujqvq,2021-07-31 00:04:30,science,This literally explains everything.,QTBloom,t2_4dgn39n3,1,0,reddit2
h75aqsw,t3_oujqvq,2021-07-31 00:04:34,science,"I just recently left a stable job of 7 years, in a career field I loced, because of toxicity caused by upper management.  I cap personally vouch for the truth in this article.",ValenOfGrey,t2_4x3d8,1,0,reddit2
h75b93n,t3_oujqvq,2021-07-31 00:08:59,science,So every graduate program should fall into this category.,,,1,0,reddit2
h75c9hr,t3_oujqvq,2021-07-31 00:17:57,science,"As a lorry driver I unfortunately see this, I feel pretty much invisible. Requests for short runs when it's a birthday or holiday are usually met with 13 hr shifts. Starting to look Into different Carrer paths now because it's gotton so bad. The job itself isn't too bad if you can manage it but the lack of respect is terrible. Also lots of grown up men bitching like nothing else. Such a shame.",Mr_Mcmanus,t2_2ettu25u,1,0,reddit2
h75clzq,t3_oujqvq,2021-07-31 00:21:00,science,I can't wait to write my resignation letter.,,,1,0,reddit2
h75cpdr,t3_oujqvq,2021-07-31 00:21:49,science,These companies could care less. You're replaceable.,therealpoopius,t2_4x5341vq,1,0,reddit2
h75crjh,t3_oujqvq,2021-07-31 00:22:19,science,"Have a close friend who ranked up extremely fast in the corporate world for their age. Like, 4 hops up in the first 3-4 years and started at a higher than average salary at the beginning. They’re working in the field they obtained their degree in and started off enjoying the job. The company is up there in the Fortune 500 list.

**Their most recent promotion has them managing a couple people and was a generous increase in salary. Their old director left and the new one is apparently disconnected from the department needs and my friend has told me the very things in the title:** they feel they don’t get enough credit/comp considering the work they do; their department is only cutting positions/resources from the department while the workload only increases in volume along with higher expectations; and they feel like they are micromanaged and have no autonomy despite having to now manage a whole department pretty much by themself, but with a conflicting manager micromanaging them.

Needless to say, they aren’t very happy lately and it was interesting for me to scroll past this post given the recent encounter.",brows1ng,t2_54euydhl,1,0,reddit2
h75d74t,t3_oujqvq,2021-07-31 00:26:13,science,\*pretends to be shocked\*,ArvinisTheAnarchist,t2_4kwbmlc3,1,0,reddit2
h75dx8r,t3_oujqvq,2021-07-31 00:32:39,science,"Another study where the results were bleeding obvious. Study finds that people who ate more food than those who didn't were more likely to put on weight. 
Study finds that people who were called by a name they did not know were less likely to respond than those who were called by their name.
Study finds that kids that were cruel to animals are more likely to turn out to be wrong 'uns than those who were nice to animals.",Cheifwhat,t2_br79d,1,0,reddit2
h75dye4,t3_oujqvq,2021-07-31 00:32:55,science,This is why I quit teaching.,Captainfreshness,t2_agtcw,1,0,reddit2
h75e2yg,t3_oujqvq,2021-07-31 00:34:01,science,"I work in a place where every day is an unreasonable demand. I have 4 guys who are there for 9-10 hours a day. They expect us to complete 70-100 hours of work a day and they will complain about how slow everyone is. Meanwhile they ask for everything in our building to be completely spotless clean like a damn hospital.

It has literally given me ulcers from the stress. We all make very good paychecks, but God damn is it stressful.",stacked_shit,t2_6lkyrut3,1,0,reddit2
h75edly,t3_oujqvq,2021-07-31 00:36:35,science,So you're saying things that suck are bad? Oh dear....,Disneyplus_and_Feet,t2_9vxyhkgx,1,0,reddit2
h75egtb,t3_oujqvq,2021-07-31 00:37:21,science,It’s called being a slave not an employee.,pimpedoutmonkey,t2_4f1545tq,1,0,reddit2
h75fr56,t3_oujqvq,2021-07-31 00:48:40,science,I quit a dumpster fire last Wednesday and I've felt better than I have in years,Accomplished-Diet-70,t2_9yw8l6qy,1,0,reddit2
h75fux2,t3_oujqvq,2021-07-31 00:49:35,science,I wonder if this is also a contributing factor in mental health problems for graduate students.,SquirrelOnTheDam,t2_a9v3qgta,1,0,reddit2
h75fxed,t3_oujqvq,2021-07-31 00:50:09,science,"Unreasonable demands and no autonomy are why I'm just jaded at my office. If I end up working on stuff for 2 weeks that gets thrown away at the end, or if I get asked to do something that should take a week in 5 hours, well it all pays the same. I'll get done what I can, and if management doesn't like it they'll learn to stop being stupid or they'll just have me do it again. But the pay is good enough idgaf if I'm forced to do dumb short sighted stuff. I'll tell them they're being dumb, but if they wanna keep being dumb ill let them as long as the paycheck keeps coming in.",IAmPattycakes,t2_fopgm,1,0,reddit2
h75g0fd,t3_oujqvq,2021-07-31 00:50:54,science,"Yeah, but it’s all about the bar graphs with the green or red line running through them.

Anyone notice that the “essential workers” in this pandemic are the lowest paid?",ColonelSpudz,t2_4e51i0j1,1,0,reddit2
h75hcv1,t3_oujqvq,2021-07-31 01:02:38,science,Source to confirm this: me,AlwaysLurkNeverPost,t2_xlh0371,1,0,reddit2
h75heyz,t3_oujqvq,2021-07-31 01:03:10,science,@dexter.school WichitaFalls,LC_chemist,t2_4i7rwnm1,1,0,reddit2
h75hf7s,t3_oujqvq,2021-07-31 01:03:13,science,"This seems like the sort of thing that companies already know, but they just don't care.",Yellow__Sn0w,t2_140653,1,0,reddit2
h75huri,t3_oujqvq,2021-07-31 01:06:59,science,Admin either doesn’t care or thinks depression and or turnover helps their cause.,didntgrowupgrewout,t2_wl6sctl,1,0,reddit2
h75i2pz,t3_oujqvq,2021-07-31 01:08:56,science,"I’m on short term disability right now because my mental health was impacted so greatly by my role that I began seriously considering committing myself because I was trying to figure out a way out. I went from one toxic environment to what turned into another, in an incredibly high stress field with minimal staff. And my blocker was my senior manager, who was doing everything in his power to make sure I had no hiring reqs and no available budget. I’m currently struggling to function at home, with no work to do. Basic tasks are incredibly overwhelming and all I want to do is sleep. I’m already diagnosed with depression and anxiety. At least I’m catching up on my sleep I guess…",WoWMiri,t2_7bnwv,1,0,reddit2
h75iftg,t3_oujqvq,2021-07-31 01:12:09,science,"The sad part is that these employers do not care in the slightest. I work for the federal government in a department that is strictly for disabled veterans. They make it a point to frustrate us, belittle us, etc. Our department head has been trying to get rid of at least half our department and replace the vets with civilian contractors because they are cheaper and can be let go much easier. They went as far as not repairing any of our equipment to make us look incompetent at our jobs. NO ONE will help us. The union ignores our phone calls and emails, OIG won't do anything, and congress (whom appointed our department for disabled veterans) won't reply back at all.",ryden760,t2_q1umi,1,0,reddit2
h75jlks,t3_oujqvq,2021-07-31 01:22:19,science,I wish my boss would read this...and realize it applied to him and the way he runs our team.,ponderwander,t2_obtii,1,0,reddit2
h75keqd,t3_oujqvq,2021-07-31 01:29:35,science,Those work places don't care if you're depressed. If it slows productivity there's always a threatening email queued about targets etc.,Roxfaced,t2_tuha6,1,0,reddit2
h75kh0k,t3_oujqvq,2021-07-31 01:30:10,science,Sounds like the military,disfordaporn,t2_55td72t5,1,0,reddit2
h75kvaa,t3_oujqvq,2021-07-31 01:33:43,science,I just dumped a job like this. Worst company I've worked for. They're the perfect example of why IT needs unions.,,,1,0,reddit2
h75lhni,t3_oujqvq,2021-07-31 01:39:13,science,My first job at Walmart  gave me some of the worst anxiety and depression I’ve ever experienced and that was from bad management and toxic employees. I haven’t worked at that job since 2016 but man I still feel the effects.,Darkone586,t2_12ruyp,1,0,reddit2
h75mc9o,t3_oujqvq,2021-07-31 01:46:47,science,Reddit sure loves to restate the blatantly obvious on a regular basis so they can justify being a neet bum all day,acuraILX,t2_5wkrms6w,1,0,reddit2
h75n1zo,t3_oujqvq,2021-07-31 01:53:08,science,Toxic workplaces also don’t care that they might be a toxic workplace.,IamJAd,t2_bltp1,1,0,reddit2
h75ncew,t3_oujqvq,2021-07-31 01:55:42,science,Obvious research yields obvious results.,kvossera,t2_kam8f29,1,0,reddit2
h75no1h,t3_oujqvq,2021-07-31 01:58:34,science,"It's been 3-4 years of in and out of bad jobs, the recent one I quit kinda broke the camel's back.. I don't feel myself anymore, but I'm hopeful :)",WanderingFaerie,t2_wz345,1,0,reddit2
h75odq1,t3_oujqvq,2021-07-31 02:04:51,science,"Man, I work at Waffle House and it’s abhorrently toxic. Rampant nepotism (to the point of my manager literally living with the 3rd shift supervisor, who never does his job yet complains about everything, in the midst of her divorce), leadership doesn’t do anything about it. I get paid decently though, just to cook eggs and bacon… but damn",iwojima22,t2_kcq6a,1,0,reddit2
h75oe0l,t3_oujqvq,2021-07-31 02:04:55,science,"I left my mixed gender workplace to work for a small mens underwear startup with just 5 dudes. Including me. 

My old work place was toxic af. I even contemplated just speeding towards a wall at one point when for work reason only i sent a woman a message outside working hours to remind her of a presentation the next day. 

Result i was brought to HR for harassment. 

That was the last straw. I submitted my resignation and left with 2 other people who were also fed up. 

My present job pays a third of what of i am earning but at least there is no sexism.",,,1,0,reddit2
h75ok6a,t3_oujqvq,2021-07-31 02:06:27,science,"I had a job that was literally making me suicidal.

Even nearly 3 years later, I have anxiety regarding my job to the point my current boss has to remind me to relax and calm down.

I was forced to go back after a temp agency baited and switched me and I was forced to go back to the same company for nearly 2 months until I found better employment.",Cananbaum,t2_afmwi,1,0,reddit2
h75onpp,t3_oujqvq,2021-07-31 02:07:19,science,Giving your employees clinical depression seems to have become a feature of capitalism in some cases.,Slapbox,t2_4ca2o,1,0,reddit2
h75pdk3,t3_oujqvq,2021-07-31 02:13:49,science,I’ve been there. Very demanding family demanded I was available 24/7. Worst people to work for,rare_pig,t2_amfco,1,0,reddit2
h75phb8,t3_oujqvq,2021-07-31 02:14:47,science,Someone should inform my chain of command about this article. The Navy is text book toxic workplace,HittemWithTheLamp,t2_dxp9z,1,0,reddit2
h75pjcc,t3_oujqvq,2021-07-31 02:15:19,science,"So, basically the entire U.S. education system?",1-900-OKFACE,t2_es2dw,1,0,reddit2
h75pjd7,t3_oujqvq,2021-07-31 02:15:19,science,Just quit a job after working there for two months because of this,nroe1337,t2_dt5rn,1,0,reddit2
h75pv3k,t3_oujqvq,2021-07-31 02:18:21,science,"Teachers everywhere: ""Oooooohhhhhhhh, okay. That explains it..""",SeymourBrinkers,t2_g3pmi,1,0,reddit2
h75q1tc,t3_oujqvq,2021-07-31 02:20:03,science,"Yeah, companies that do this don’t care if their workers are depressed.",Scarlet109,t2_l811e,1,0,reddit2
h75q8mr,t3_oujqvq,2021-07-31 02:21:45,science,Someone send this to Blizzard.,,,1,0,reddit2
h75qmwm,t3_oujqvq,2021-07-31 02:25:24,science,I quit my toxic job on Tuesday. Getting these past few days off to rest has been so refreshing that I can feel my will to live a creative life slowly returning,,,1,0,reddit2
h75r4f2,t3_oujqvq,2021-07-31 02:29:54,science,Stop working for others! Stop the 9-5’s. Borrow money from the banks and invest instead!!,rduenas12,t2_2m042iau,1,0,reddit2
h75r4ty,t3_oujqvq,2021-07-31 02:30:01,science,"*suprise Pikachu face

Doi.",notconvinced3,t2_64brm,1,0,reddit2
h75rjc5,t3_oujqvq,2021-07-31 02:33:43,science,"At my previous job, things got really bad. Management was giving no real direction and when tasks were given,  o support was provided - even when asked. I was a sales rep, and the owner of the company changed my commission structure, but wouldn’t give the new structure to me in writing. The company itself had no new products that were company designed, and all modern products were OEMed from others. Our prices were high and lead times were long with promised ship dates slipping on the regular. Things were bad. The owner of the company would gaslight me when I brought concerns, and towards the end of my employment with them, I was recording every conversation I had with that owner on my Apple Watch. 

I remember driving in to work one day, and my left arm start to ache with pain going into my hand and up the back of my neck. I thought to myself, “ I’m having a heart attack. This is how I die.” I continued to drive, and realized I didn’t care.  I got to work and immediately called my GP, and at my doctor’s appointment a few days later, I was told that I had a panic attack and put on antidepressants. I left that job in May 2020. Two weeks after I started my new job, I tapered off of the antidepressants, and I haven’t needed them since.",gekiganger5,t2_906o9,1,0,reddit2
h75rxea,t3_oujqvq,2021-07-31 02:37:17,science,A study had to be done in order to find this out? I need to speak to a manager.,abryan135,t2_12085y,1,0,reddit2
h75shnl,t3_oujqvq,2021-07-31 02:42:33,science,"...*hello*... it's me, the restaurant industry....",BeyondEarthly,t2_bnf4l,1,0,reddit2
h75tjac,t3_oujqvq,2021-07-31 02:52:27,science,"IMO,  most large companies could care less if employee's suffer as long as the CEO, Executive and Shareholders are increasing revenue and filling their pockets. Government agencies are complacent and just there to provide a lip service and good optics, but they don't really do anything. The only time these issues pick up steam is when there is a public outcry.

I am optimistic though, employees are slowly starting to become more aware of these issues. Hopefully it picks up steam.",FrostyButters,t2_14euj5,1,0,reddit2
h75uqh7,t3_oujqvq,2021-07-31 03:03:47,science,Welcome to all government work,medusadaughter,t2_5228mqhs,1,0,reddit2
h75vi5l,t3_oujqvq,2021-07-31 03:11:03,science,"They know, they just don’t care",Ihavedirtythoughts88,t2_113v2g,1,0,reddit2
h75vpkp,t3_oujqvq,2021-07-31 03:13:03,science,"What about getting yelled at, is that in their study?",mlayman13,t2_deyfj,1,0,reddit2
h75vqts,t3_oujqvq,2021-07-31 03:13:23,science,"I JUST walked out on a toxic job during my lunch yesterday. 

Oddly enough it was because it was making me miserable due to those EXACT three reasons. 
Don’t be afraid to leave a bad job. There are so many options, especially now.",therealgrayson_,t2_599q69s,1,0,reddit2
h75w6it,t3_oujqvq,2021-07-31 03:17:37,science,"Personally the good ole pat on the back for going above and beyond doesn't help, nor does a pizza party.",ARedditingRedditor,t2_gka5g,1,0,reddit2
h75wl42,t3_oujqvq,2021-07-31 03:21:32,science,"Companies know this and do not care. Worked in the front office of a large distribution center right after college where I was expected to work one or two extra hours late almost every day and only get paid for 40 hours and workers were regularly told they were expendable and easily replaceable. Actually got called into a meeting one time and told we didn’t have to respect the managers / supervisors but we’d better act like we did. Horrible, horrible place to work. Many years later, my son said he had a friend who got a job there and it was still as bad. His friend left there after like two months.",BadLuckCharm1966,t2_5ixywq9z,1,0,reddit2
h75wp47,t3_oujqvq,2021-07-31 03:22:38,science,Yeah we’re looking at you Frito Lay.,xlnthands,t2_b2y6a,1,0,reddit2
h75wqpa,t3_oujqvq,2021-07-31 03:23:04,science,"Leaving my toxic workplace next week, for a bigger salary than i asked, less hours, less days, company lunches, no working public holidays or weekends. My mental health improves even looking forward too it",childrenovmen,t2_11qohi,1,0,reddit2
h75x1dv,t3_oujqvq,2021-07-31 03:25:59,science,You need a stay for this?,anonisbull,t2_krd9r,1,0,reddit2
h75xyub,t3_oujqvq,2021-07-31 03:35:05,science,Literally me! But I make 6 figures a year and really hard to walk away from that... I have no friends and no love life but I have fast cars and make stupid money instead of wasting it on women haha,Ok-Award-9515,t2_a3f0juej,1,0,reddit2
h75z0xk,t3_oujqvq,2021-07-31 03:45:39,science,Guess that's why I've been depressed the past six years,Innocentrage1,t2_7vzdhvu9,1,0,reddit2
h75z58k,t3_oujqvq,2021-07-31 03:46:52,science,And somebody got paid to do a study to find this out…,elf25,t2_4b4m0,1,0,reddit2
h75zvem,t3_oujqvq,2021-07-31 03:54:07,science,"Hello, ever worked in a restaurant before?",jaquhtac,t2_5siexd1x,1,0,reddit2
h75zww9,t3_oujqvq,2021-07-31 03:54:33,science,Is this the military? * *in reference to is this a pikachu meme* *,bokoblindestroyer,t2_8fgzkprr,1,0,reddit2
h760ora,t3_oujqvq,2021-07-31 04:02:22,science,And companies don’t give af. Burn someone out and then replace them with someone cheaper.,,,1,0,reddit2
h760uvz,t3_oujqvq,2021-07-31 04:04:06,science,"Can anecdotally confirm. My last employer absolutely ran me into the ground, and it's the only time I've been borderline suicidal.",serafel,t2_fy8jt,1,0,reddit2
h7612i3,t3_oujqvq,2021-07-31 04:06:15,science,"I honestly love my staffs they are my greatest assest, my biggest investment. Im nothing without them, i cant coach a team with out team!. Not all money is good money!.

 I try to get the most from staff, all I really do is build on strenghths.... very simple, seems to work.",jessowski,t2_4jgi3hnv,1,0,reddit2
h762ca7,t3_oujqvq,2021-07-31 04:19:28,science,"That’s pretty much every work space. I think we would do better to say that the mean, unrealistic and over the top expectations that work places put on us should not be taken to heart. It’s a sign of a sick and dysfunctional society and economy, and no amount of hard work by an individual will change fix the situation for the corporation you are working for.",D-rad01,t2_qjubr,1,0,reddit2
h762op7,t3_oujqvq,2021-07-31 04:23:03,science,Tell me something I don't already know.,Warx,t2_7dtpj,1,0,reddit2
h763861,t3_oujqvq,2021-07-31 04:28:53,science,"This is so true. I recently quit my job for a new one. I've always kinda made self depreciating jokes typically about suicide or general lack of interest in really about everything. Always in a joking sense or at least I thought. Today somebody ask me how I was at work. I went with a typical response of ""well im here"" and I had to correct myself to ""really good"". I actually enjoy my new job and feel happy for the first time in a decade. I wouldn't say I hated my previous jobs but its painfully obvious now how much they contributed to my overall mental health.",extracrispygansta,t2_bkdukq15,1,0,reddit2
h763li3,t3_oujqvq,2021-07-31 04:32:52,science,The real question I wanna ask.... Is there a place to work with no toxicity????,da_real_bigb,t2_7t2nv,1,0,reddit2
h7640ua,t3_oujqvq,2021-07-31 04:37:32,science,Now to just get them to care about it.,Loghurrr,t2_11jqlp,1,0,reddit2
h764exg,t3_oujqvq,2021-07-31 04:41:52,science,Now is when I wish reddit would let me reply in memes. Because <shocked Pikachu>,iamgherkinman,t2_6wwr960,1,0,reddit2
h764gxv,t3_oujqvq,2021-07-31 04:42:29,science,Dynorphin and kappa receptors.,MethForCorona,t2_8jsdh26j,1,0,reddit2
h764plh,t3_oujqvq,2021-07-31 04:45:11,science,I mean… do we need to hear a scientific report on this? I feel like its pretty damn obvious that its the case,mugs_p2,t2_195zscqa,1,0,reddit2
h764zij,t3_oujqvq,2021-07-31 04:48:14,science,Don’t work for any military then,JRfriends93,t2_20xz2822,1,0,reddit2
h765fnh,t3_oujqvq,2021-07-31 04:53:17,science,"i joined a startup for the first time ever from a private consultancy background and although the pay was double, i hated it. the politics, the backstabbing, the force you to fire someone on someone else's behalf, etc. i became extremely angry, short temper, and doubt everything and everyone else. luckily my SO had the biggest heart and patience to see me through that. quit a year back and never look back since.",buguz,t2_12lqf7,1,0,reddit2
h765y5h,t3_oujqvq,2021-07-31 04:59:08,science,"My boss once said “I don’t get thanked at the end of the day so why should I thank anyone else?” 

As a supervisor, I thank everyone I’m in charge of when they leave for the day. It takes absolutely no effort at all but makes people feel appreciated. Especially if it has been a difficult day.",Cophed,t2_rfoad,1,0,reddit2
h766jkn,t3_oujqvq,2021-07-31 05:06:04,science,I’m getting my affairs in order to leave a toxic work environment as we speak! I’m getting so excited a mass exodus is happening! Hopefully enough people leave so that our non-compete contracts are void.,TheJustinExperiment,t2_gw4xl,1,0,reddit2
h767wdi,t3_oujqvq,2021-07-31 05:21:59,science,You say that like they would care?,theferalturtle,t2_4efth95c,1,0,reddit2
h768geb,t3_oujqvq,2021-07-31 05:28:36,science,Anyone who has worked for Amazon could have told you that.,Idnetxisbx7dme,t2_13p7da5t,1,0,reddit2
h768nfe,t3_oujqvq,2021-07-31 05:30:56,science,"wow im depressed the last 14 years and i worked here and there so nah, you are just fucked up. Every workplace is stupid so just get therapy.",,,1,0,reddit2
h769qkj,t3_oujqvq,2021-07-31 05:44:14,science,Welcome to healthcare!,toltectaxi99,t2_bq1q62ul,1,0,reddit2
h76a63v,t3_oujqvq,2021-07-31 05:49:35,science,I dont even get it. Studies have shown that toxic employees do more damage to the workplace than incompetent employees. So what are we doing? Just fire those assholes.,joshua070,t2_3busnmaf,1,0,reddit2
h76ae34,t3_oujqvq,2021-07-31 05:52:22,science,"Wow, that headline describes my QA job perfectly. 
God I need a hug.",Lola_PopBBae,t2_2ndb1wu7,1,0,reddit2
h76axn4,t3_oujqvq,2021-07-31 05:59:27,science,Many people here blaming management are just whiney operations people who think they're the center of the universe. Newsflash! I don't have to know every detail of what you do to manage your role in the organization. Operations people suffer from persistent solipsism. I was in Ops for 25 years. You're not as elusive and complicated as you think.,kal0kag0thia,t2_4k2tg739,1,0,reddit2
h76b8jr,t3_oujqvq,2021-07-31 06:03:18,science,Petco was extremely toxic and I left. They hired me on the spot and then I quit in less than a month. Everyone was miserable.,Awellplanned,t2_vehlzov,1,0,reddit2
h76cqhz,t3_oujqvq,2021-07-31 06:22:51,science,"Companies reading this:

\*Loki meme yes, very sad :(...

Anyway!\*",bzbee03,t2_3nnx3src,1,0,reddit2
h76dgz3,t3_oujqvq,2021-07-31 06:32:41,science,I need to forward this to all of my last few workplaces,Coduuuuuuuuuuuuu,t2_21yf4j9e,1,0,reddit2
h76eczp,t3_oujqvq,2021-07-31 06:44:40,science,"This applies also to childbirth... as a toxic home will make the kid troubled in the future. 

Vice versa if the home is not toxic, the kid will be sucessfull... 

Imagine you water a plant with fertiizer, water, and sunlight.... 

The plant will have food + water + light to burn off the calories... 

now imagine that plant fed with junk food, gasoline, and the night... 

It will be weak, wither, and die. 

""your 5 closest friends will be the accumulation of you""

I work at home depot... the place lacks the responsbility to work on making an enviroment good enough for the associates to fully thrive in.",Trevor2472,t2_ck31q,1,0,reddit2
