id,parent_id,created,subreddit,body,author,author_fullname,ups,downs,api_source
h72qsr8,t3_oujqvq,2021-07-30 12:35:11,science,"Welcome to r/science! This is a heavily moderated subreddit in order to keep the discussion on science. However, we recognize that many people want to discuss how they feel the research relates to their own personal lives, so to give people a space to do that, **personal anecdotes are now allowed as responses to this comment**. Any anecdotal comments elsewhere in the discussion will continue be removed and our [normal comment rules]( https://www.reddit.com/r/science/wiki/rules#wiki_comment_rules) still apply to other comments.

*I am a bot, and this action was performed automatically. Please [contact the moderators of this subreddit](/message/compose/?to=/r/science) if you have any questions or concerns.*",AutoModerator,t2_6l4z3,1,0,reddit2
h73qsw2,t3_oujqvq,2021-07-30 17:05:59,science,"I experienced this first hand. Turns out Im not ""not a morning person"". I just didn't want to get out of bed to face the day.",bolognahole,t2_7toek,650,0,reddit2
h73t5xq,t3_oujqvq,2021-07-30 17:22:40,science,[removed],,,500,0,reddit2
h740t70,t3_oujqvq,2021-07-30 18:17:40,science,"A year past leaving a toxic work place.

Glad I did, I don't think I'd have survived, but not sure I'll ever recover - just broke inside.

If you're in a toxic work place, get out as soon as you can, it's seriously not worth it and can mess up your entire life and those around you.",ThanklessTask,t2_59twb,492,0,reddit2
h73wn9l,t3_oujqvq,2021-07-30 17:47:30,science,And restaurants are wondering why everyone’s quitting,pixelastronaut,t2_6l7mb,655,0,reddit2
h73vf3z,t3_oujqvq,2021-07-30 17:38:45,science,"Also: workplace bullying, ""we are family"" workplaces, and the general pressure to be super productive, ""on"" all the time, always available to work even during your off time.",Known_Appeal_6370,t2_a13v23b9,490,0,reddit2
h72rwwl,t3_oujqvq,2021-07-30 12:45:33,science,"I've been fortunate to work in a non-toxic  manufacturing environment. We all are fairly friendly, we help each other out. We're paid a monthly incentive bonus based on overall shipments, scrap, customer complaints, etc. We have a cookout every once in a while. Stuff like that makes everyone feel valued for their services and time. My particular work area is next to a garage door, and outside of that door are trees. The mental health boost of seeing trees nearby is HUGE when you run similar parts on CNC machines all day.",chillford-brimley,t2_jkxjg2p,1196,0,reddit2
h747crh,t3_oujqvq,2021-07-30 19:03:05,science,"Psychotherapist checking in: I’ve seen numerous examples of depression being essentially cured by quitting a job with toxic work environment. The sad part is, psychotherapy was required to help the person get to place where they felt strong enough to quit. 

These work environments make people depressed, which consistently makes folks feel like they can’t escape either. 

If you hate your job so much you are considering going to therapy, save yourself some time and money and just start applying to new jobs. Go to therapy too, if you want, but don’t delay the job search.",ellivibrutp,t2_7nfkx,430,0,reddit2
h73xz7d,t3_oujqvq,2021-07-30 17:57:00,science,[deleted],,,135,0,reddit2
h73bz4k,t3_oujqvq,2021-07-30 15:24:24,science,"It's very obvious that someone has been injured if they lose a limb or a finger in an industrial machinery accident. But, injuries like this are not looked at as ""real"" or something you need to ""get over"". I'm looking forward to a day where we can readily and authoritatively recognize mental damage from work environments and hold employers accountable, in precisely the same way as someone who is outwardly, physically injured.",RudeTurnip,t2_4albl,546,0,reddit2
h73sfti,t3_oujqvq,2021-07-30 17:17:36,science,THIS SUCKS! I'm going though this right now.. But I can't leave my job as I pay for my wife's education every month and its about the same as our rent. I'm a video editor if anyone needs one. I have a great portfolio with hundreds of videos if your interested. I can't handle this job anymore. I'm editing 16 wedding videos a month.,Undervaluedsticks,t2_160os7,100,0,reddit2
h73cu7z,t3_oujqvq,2021-07-30 15:30:38,science,">not give them autonomy

I had a job where  5 years into it I got a new manager, and I kept having to teach him how to do something, then immediately ask him permission to do the thing I just taught him how to do. If he hesitated to give permission, I then had to teach him why he absolutely had to give me the permission and the (sometimes legal) consequences of not letting me do it.

He always gave the permission but it was so belittling to me. I'd worked there 5 years and was basically the expert that everyone came to for help in that area, but I still had to get the OK for every little thing.

It was a major reason why I quit.",BiggieWedge,t2_6jvdv,400,0,reddit2
h73t1gs,t3_oujqvq,2021-07-30 17:21:49,science,"I needed to see this today. It's not me, it's them. I need to leave.",WanderingJaguar,t2_5kesd8tv,79,0,reddit2
h72x0jx,t3_oujqvq,2021-07-30 13:30:08,science,Basically all retail establishments,Entropy308,t2_rglah,193,0,reddit2
h73prx9,t3_oujqvq,2021-07-30 16:58:44,science,"My last job's work environment was so toxic I became the most depressed I've been in my life. Finally found a new job 5 years ago and it took a good 3 years to heal from that...including medication!   


Toxic jobs are often a result of shortcomings of the owners/managers and nothing to do with you. They're not able to solve an issue, so you become the scapegoat for those issues:  
\-It's not the company's business model that's unprofitable- it's your lack of productivity!  
\-It's not that the procedures are inefficient- you're not following them properly!  
\-It's not the products that have flaws- it's how you're handling customer service!  
etc  


After finding a great place to work, I was shocked that a career could actually be enjoyable and fulfilling :D",Fritzo2162,t2_afq2c,189,0,reddit2
h7412z8,t3_oujqvq,2021-07-30 18:19:38,science,"This hits me so hard. My current boss is not trustworthy. He's spineless, he shields his decisions behind human resources policies, he doesn't treat employees equally, and he has absolutely no ability to respond to any form of confrontation. He treats me and my counterpart differently, he BCCs constantly on email, and I know for a fact that I make $20k more a year than my counterpart. 

My team trusts me, they know I'll have their back no matter what and if a policy is keeping them from success, I'm going to break that policy and affect change at the company. I'm quitting my job because of my boss and when I told my team I was leaving, over half of them asked if they could come along.  

I hate leaving, I actually love my job, but my boss is just a complete disaster. He's nice and likable but he's a terrible leader and I don't trust him at all.",flavorburst,t2_7xfof,56,0,reddit2
h7348t5,t3_oujqvq,2021-07-30 14:27:15,science,I'd love to forward this to my manager. I was already depressed when I arrived but it sure as hell doesn't help.,SkyScamall,t2_17beck,144,0,reddit2
h72umdg,t3_oujqvq,2021-07-30 13:09:51,science,[removed],,,444,0,reddit2
h73qsu1,t3_oujqvq,2021-07-30 17:05:58,science,"Having worked in some extremely toxic environments, it definitely has had an effect on my mental health.

In one job, I was consistently the top performer. I was the dude everyone came to when they didn't know what to do. I trained new hires. Yet, management would regularly pull me in the office and wear me out and threaten my job. It was so bad that I would sit in my car outside the office and smack myself in the face to hype myself up enough to go in. I finally quit, and immediately felt like a weight had literally been lifted from my shoulders.

My last job was in a call center and while it wasn't as dire as the above example, constantly having everything I do tracked down to the second and audited definitely wore on me. I coped by being cynical. I went from being the bright-eyed, enthusiastic, extra mile type to just doing the bare minimum because doing the bare minimum was better for my metrics. It bled over into my personal life, and I just had no enthusiasm for anything.

Now I have a job where I work independently at home. Yesterday I was jamming the hell out playing the air drums with my music blasting while I cranked out my work. So much happier.",jmanpc,t2_69scw,106,0,reddit2
h749ckp,t3_oujqvq,2021-07-30 19:17:28,science,[deleted],,,34,0,reddit2
h73wa81,t3_oujqvq,2021-07-30 17:44:56,science,"My mental health took a massive dive in the last six months and I attribute it entirely to a toxic work environment. Fortunately, I just obtained a job offer for a similar role that will nearly double my salary and likely result in less hours worked.",CakeDayisaLie,t2_aqhrj,36,0,reddit2
h745zk6,t3_oujqvq,2021-07-30 18:53:22,science,"All of our employees are upset and don't want to work?

Pizza lunch!",FF_Master,t2_a1ucgcs1,32,0,reddit2
h7357p1,t3_oujqvq,2021-07-30 14:34:33,science,"Having met a lot of people I sincerely think some people understand this and are simply evil, extracting their self worth by walking over other people.",Mean_Total_8224,t2_7jn5sjt3,129,0,reddit2
h745xul,t3_oujqvq,2021-07-30 18:53:01,science,"Restaurants: ""Why does no one want to work anymore?"" 

Literally have a degree in biomedical engineering and a masters in economics but fell on hard times so I gt a job in a restaurant. Still got talked down to like I was simple and compeltely unacknowledged about the systems of efficiency I implemented with the very little amount of autonomy I did have.",,,25,0,reddit2
h7361gb,t3_oujqvq,2021-07-30 14:40:45,science,"Having to work 5 days a week (some 7) is depressing enough. I'll never understand the 'grinders' who work 80+ hours a week in an attempt to make it out of that situation. 

I make more than the comfort zone salary and I'm still stuck here. How much do you have to grind for to make it out? All you're doing is burning yourself out, which will make your depression that much worse when your body gives up.",jbraden,t2_5spal,80,0,reddit2
h73yfch,t3_oujqvq,2021-07-30 18:00:15,science,"I really hate that nobody will believe poor people until there's 1500 peer reviewed studies definitely showing it's true.

I've previously seen studies citing it doubled your risk of depression, so I guess workplaces are just becoming more emotionally abusive over time (not surprising)",,,59,0,reddit2
h733mu0,t3_oujqvq,2021-07-30 14:22:35,science,"I find it baffling that this sort of thing isn’t just common sense but at least it explains a lot for those who don’t have it.

In my experience it’s been very apparent these sort of things have had a negative impact on myself and those around me, including an odd tendency to discourage coworker friendship and encourage isolation.",stairhopper,t2_nzz62,43,0,reddit2
h73m20y,t3_oujqvq,2021-07-30 16:32:43,science,Oh yeah I was working one of those and was super depressed and stressed. Got a new job that’s reasonable and likes how I work and it’s incredible. Sometimes I find myself smilingly work for no reason and I don’t remember the last time I did that.,ToFoSho,t2_mtab0,15,0,reddit2
h749ddu,t3_oujqvq,2021-07-30 19:17:38,science,[deleted],,,13,0,reddit2
h73yanu,t3_oujqvq,2021-07-30 17:59:19,science,And for some reason some  people are unsure of why the military has these problems in spades.,IkeDaddyDeluxe,t2_4e7qowpl,13,0,reddit2
h73h4lb,t3_oujqvq,2021-07-30 15:58:01,science,"Wow, that pretty much sums up the entire construction industry, at least in the US.",dark_lord_xandros,t2_16bszp,26,0,reddit2
h73psu4,t3_oujqvq,2021-07-30 16:58:54,science,"I just started at a company that is completely toxic. It’s 30-year old “startup” with a founder who micromanaged everyone, including executives. So they micromanage their teams. The place is understaffed, I’m expected to get the work of 2-3 people done in a day. If I say it’s overwhelming or complain about 12+ hour days 6 days a week? Then I’m told no one is telling me to work that much. Well…no i guess that’s not exactly what they say, but they are telling me I am expected to finish the workload. The boss yells at people and belittles them. She has her pets (thank god I’m one of them) but if you’re not on her good side, you can expect to be ridiculed behind your back. Clients?? Well, we’ve lost many of them because the boss frequently yells at them. 

The article says to leave or take a vacation. Well, I can’t do either. The former requires someone else to want me and the latter leaves me with 5x more work to do when I get back. 

The article doesn’t mention how I imagine most of us in these toxic environments manage it: self medication. I can’t talk to a therapist cause I can’t afford it and my insurance won’t help me (yes I’m American). I can’t quit cause I have bills to pay. So I drink. And smoke. And I’ve started trying to microdose mushrooms to help with the depression. For me, the mushrooms are helping the most. Ymmv.",OnomatopoeiaMamaMia,t2_8fgfkxhn,44,0,reddit2
h7407et,t3_oujqvq,2021-07-30 18:13:16,science,"My last place was exactly like this.  Pierce MFG can eat my ass, if you see a fire truck theres a 50/50 chance its made from them.  They can eat my ass.

This not only causes depression, but results in new employees that were supposed to be replacing retirees leave for other companies.  If you have a product that takes years to learn you shouldnt be paying bottom dollar.  The only people that stay are the old fucks who still have their pensions and have invested so much time into the company they literally cant leave.  Everybody else that can get out does.  

Then the company wants to turn around and go ""why is our product coming back so often for warranty repairs"" like its some big ass mystery",rudyv8,t2_9484d,8,0,reddit2
h73smc3,t3_oujqvq,2021-07-30 17:18:52,science,The exact reasons I left Amazon,FeedonFear,t2_xpu0i,9,0,reddit2
h73u4hw,t3_oujqvq,2021-07-30 17:29:30,science,"I worked it a toxic workplace, it was awful. I also worked in a place where employees went to full weekends together, wearing the same shirts and hats, singing song in a bus. Those weekends were “mandatory”. I’m honestly not sure which one was the worst…",Math1988,t2_81zf9,8,0,reddit2
h73g2lm,t3_oujqvq,2021-07-30 15:51:50,science,A lot of companies don’t care….soo…,ALPHAGINGER74,t2_hmuxc,17,0,reddit2
h73vlje,t3_oujqvq,2021-07-30 17:40:01,science,"This absolutely rings true for me. I work at a 911 dispatch and it checks all the boxes. It's a big ""Mean Girl's Club"". It is incredibly stressful due to emergency calls, lack of staffing, cops being assholes over the radio, no actual break periods (lunch time is scarf it down between calls and traffic stops or eat it cold), and don't even get started with adding warrant entries on top of all that. We're constantly told by people who can't do the job themselves (cops) that we suck. Finally the lack of autonomy is a big one too. It's like we're there to be pissed on by everyone else. I love helping people but I can't do it like I used to anymore. The job will destroy your mental faculties over time and I've seen it in many dispatchers that have come and gone. I'm now only part time there because I value my sanity more than money. If you're looking to be a dispatcher proceed with caution, make sure you have family and friends at the very least who can be there and support you on the bad days, and don't be afraid to ask for help yourself.",Awsmdustin69,t2_wfqv2,9,0,reddit2
h740s73,t3_oujqvq,2021-07-30 18:17:28,science,So basically every US emergency and ICU department in the country right now is operating at the managerial level to cause depression upon the staff of people actually doing the risky and real work.,LearnAndTeachIsland,t2_7oi993c8,8,0,reddit2
h74c3h7,t3_oujqvq,2021-07-30 19:36:04,science,With all these stories where the hell are people finding the money to pay double price for a house from a year ago?,jimothyjones,t2_b48we,7,0,reddit2
h740nxk,t3_oujqvq,2021-07-30 18:16:36,science,"I thought that was the point. Completely crush their souls, remind them daily they are replicable, take any credit for ideas they have, and dangle the paycheck needed to survive over their heads. I thought that was the base model for capitalism",Prestigious_Garden17,t2_a97ipz2a,6,0,reddit2
h7413kh,t3_oujqvq,2021-07-30 18:19:45,science,Imagine that—treating people like human beings prevents depression. Who’d have thunk it.,Timthefilmguy,t2_3y82e9r,6,0,reddit2
h73n8ot,t3_oujqvq,2021-07-30 16:40:59,science,Capitalism is the reason we're having a mental health crisis!,Firepower01,t2_7qmw9,47,0,reddit2
h73xm01,t3_oujqvq,2021-07-30 17:54:20,science,"I’ve experienced that first hand.  It’s made me seek out jobs where I’m on my own a lot and rarely encounter management, which is great but I miss having work friends a great deal.",GlitteringVillage135,t2_64nvirx8,5,0,reddit2
h744vvo,t3_oujqvq,2021-07-30 18:45:35,science,"Then I'm safe, already got the depression",makuff,t2_l893p,4,0,reddit2
h73jt8r,t3_oujqvq,2021-07-30 16:17:01,science,"It gets old just being an ordinary, replaceable worker. I never thought being invisible would sting so much.",TedBundysVlkswagon,t2_fnkng,9,0,reddit2
h7481te,t3_oujqvq,2021-07-30 19:08:03,science,Nursing enters the chat.,chelseaawilde,t2_68ysfbpa,9,0,reddit2
h73krwb,t3_oujqvq,2021-07-30 16:23:40,science,"I'm very lucky to have my wife, pets and friends to survive the downturn of my work environment. It's been tough, and getting worse, but Ive got some good prospects on some different jobs",DaSwayza,t2_vdo5w,7,0,reddit2
h748zxl,t3_oujqvq,2021-07-30 19:14:53,science,[deleted],,,4,0,reddit2
h73nyoe,t3_oujqvq,2021-07-30 16:46:00,science,*Blizzard did not like that*,,,9,0,reddit2
h73oujf,t3_oujqvq,2021-07-30 16:52:12,science,Every 60 minutes an hour goes by.,DLife4Me,t2_3c8zjr8q,9,0,reddit2
h73ac37,t3_oujqvq,2021-07-30 15:12:33,science,Last thing I want is attention for doing a good job. I want as little attention as possible at work so I can do my own thing and get the work done my way.,tomster785,t2_lehqd,9,0,reddit2
h73y3xd,t3_oujqvq,2021-07-30 17:57:57,science,"This kind of work environment was the reason I changed careers. Absolutely fried me. As soon as you start feeling the pressure, get out! If you love the thing that you do, don't let a bad employer take that from you.",ogod_notagain,t2_8ejzz,3,0,reddit2
h740t2t,t3_oujqvq,2021-07-30 18:17:38,science,Sounds like every job I’ve worked since I was 16.,drinkallthepunch,t2_11agbtbt,3,0,reddit2
h741tcq,t3_oujqvq,2021-07-30 18:24:48,science,"I haven't even gotten my second paycheck at this place...and both managers have already invited me to walk out and not come back on separate occasions...I've never had an employer speak to me that way, or get angry with me so early in. I do a good job and extra work without being asked while those 2 bicker all day every day. Im on my feet 7-11 hours doing dishes and prep with only a couple 5 minute breaks here and there. I almost walked out yesterday, but I'm toughing it out to pay my overdue bills. Started a second job yesterday too. All the while I live out my car to pay everything off faster. Lord, help me. Thank goodness I'm getting to watch a friends place so for a few days I can sleep inside.",frizzlefrats,t2_yz6ki,3,0,reddit2
h742pkt,t3_oujqvq,2021-07-30 18:31:16,science,Companies run by inhuman ghouls and criminal psychopath CEOs are a threat to public health and the public interest https://www.independent.co.uk/news/world/australasia/psychopaths-ceos-study-statistics-one-five-psychopathic-traits-a7251251.html,6SucksSex,t2_1741oy,3,0,reddit2
h746ppx,t3_oujqvq,2021-07-30 18:58:32,science,Someone show this to CVS. Those poor workers.,Robertofontaine,t2_sa03r,3,0,reddit2
h7492bj,t3_oujqvq,2021-07-30 19:15:23,science,"This is my job right now. We lost 8 in my department. Now it's just me and another guy. We are doing the work of many people...with no increase in pay, no title change, no thank you or acknowledgment for holding it down for almost two years, and continued pressure to take on even more work that we weren't even hired for in the first place. Time to leave.",Spacebotzero,t2_55368,3,0,reddit2
h74b7yt,t3_oujqvq,2021-07-30 19:29:39,science,In my experience it doesn't take a lot of mistreatment to become depressed.  I just think that most people think the depression is normal.,Throw-AwaySteve,t2_721cojke,3,0,reddit2
h74di23,t3_oujqvq,2021-07-30 19:46:19,science,Welcome to the world of they don't give a f***,WestCoastSunset,t2_ibcn7,3,0,reddit2
h74icjh,t3_oujqvq,2021-07-30 20:20:37,science,"I work in as a web developer for a fintech company and just knowing that they want us to go back 100% to the office soon gives me incredible anxiety just thinking of the amount pf traffic I’m going to face. Looking for a new job has not been great with companies asking for so much more than what is done in a daily basis and moving closer is not an option due to the extreme cost of living and my employer doesn’t give any raises. Feels like they want us to become stuck there so that they don’t loose us instead of actúa giving us better incentives to work harder. Hell one of their competitors was offering positions and hired about 12 developers from my employer until they received a cease and desist from my employer to stop them from giving jobs we want.

I now take anxiety and stress medication thanks to them.",,,3,0,reddit2
h74n426,t3_oujqvq,2021-07-30 20:54:56,science,"I went through this with my last employer, not to mention the anxiety and the stomach problems. I finally left and it turns out that all three came from the workplace and the low wages instead of being me.",owtbound,t2_6obrm,3,0,reddit2
h74ngtt,t3_oujqvq,2021-07-30 20:57:35,science,"No democracy in the workplace de facto means no democracy anywhere. Powerful corporations are run like dictatorships, and they lobby Congress using the massive leverage their massive power allows. Dictatorial institutions run everything and you all still think we live in a democracy because they occasionally poll you to see which wealthy elite you'd prefer making decisions for you. If there is no democracy in the workplace there is no democracy anywhere.",NONEOFTHISISCANON,t2_tq54g,3,0,reddit2
h74rlx4,t3_oujqvq,2021-07-30 21:27:43,science,"Yup, I’ve worked in a high end kitchen where happiness is frowned upon, no jokes or laughter, only prep and service, breaks were not allowed, even during a 15 hour shift, no sunlight, no respect, plates being thrown back at you if they weren’t *perfect,* etc. Sure enough, that was the height of my drinking and my depression.

It really ruined professional kitchens for me, even after spending so much on culinary school.",Loyalist_Pig,t2_8gnuh,3,0,reddit2
h73mry4,t3_oujqvq,2021-07-30 16:37:42,science,"Wow that's great, they still don't care at all though",Sushigami,t2_c1ppc,5,0,reddit2
h73ksuu,t3_oujqvq,2021-07-30 16:23:51,science,Lucky me. I have an asshole boss I’ve had to report to HR twice and I already have depression. Woo hoo.,Sharpiebanana,t2_8z3a7j4c,4,0,reddit2
h739kq0,t3_oujqvq,2021-07-30 15:06:55,science,"r/medschool
r/medicine",Rei1313,t2_tncvc,4,0,reddit2
h73rhiq,t3_oujqvq,2021-07-30 17:10:50,science,"New study finds “if you don’t like most of your waking life you will be sad most the time you are awake!” 

Who gets paid to do these “studies”",Phobic-window,t2_78n7p9mm,7,0,reddit2
h73sp5e,t3_oujqvq,2021-07-30 17:19:26,science,I can attest to that. It got so bad I had to be on pills.,TGOTR,t2_pexy6,2,0,reddit2
h73tfmm,t3_oujqvq,2021-07-30 17:24:35,science,"This kinda sounds like parenting, in a nutshell.",Srprehn,t2_j31k4,2,0,reddit2
h73z8s2,t3_oujqvq,2021-07-30 18:06:14,science,Some even give their workers pizza parties after 20+ people write a letter about how toxic the work environment is.,ravioli_king,t2_174czi,2,0,reddit2
h741mpz,t3_oujqvq,2021-07-30 18:23:28,science,"UHC be like...

I can't afford to see a therapist but please keep sending me emails on what the board of directors learned on their company funded ski trips.",robo-hodor,t2_m1amo,2,0,reddit2
h741ud4,t3_oujqvq,2021-07-30 18:25:01,science,"A toxic environment makes you feel bad? 

*SurprisedPikachu.jpg*",DotJata,t2_n8h2d,2,0,reddit2
h741wam,t3_oujqvq,2021-07-30 18:25:24,science,Ever since I insisted on *not* taking my job seriously me mental health got a noticeable boost.,shinslap,t2_diavv,2,0,reddit2
h742p4n,t3_oujqvq,2021-07-30 18:31:11,science,Blizzard needs to read this,lan60000,t2_p3l91,2,0,reddit2
h743p41,t3_oujqvq,2021-07-30 18:38:28,science,"And since that might not mean anything to sociopathic CEO's...that means lower productivity, higher turn-over and higher sick costs...less money for you.",PopeKevin45,t2_afotq,2,0,reddit2
h745x9p,t3_oujqvq,2021-07-30 18:52:54,science,"Almost every job I’ve had has in a way been toxic. Dairy Queen, dutch bros, Intuit and now Starbucks. Corporations are literally the worst you’re just a number to them.",Nickjaggerrrr,t2_40uyje33,2,0,reddit2
h74986q,t3_oujqvq,2021-07-30 19:16:35,science,I can’t believe this is considered to be new news …..,whatcrawish,t2_11vp6dqo,2,0,reddit2
h749cvc,t3_oujqvq,2021-07-30 19:17:32,science,"R/OctoberStrike 

cure what ails ya,come fight with us!",sarahfuckingconner,t2_b6b3g1xe,2,0,reddit2
h74bgcv,t3_oujqvq,2021-07-30 19:31:23,science,"I mean, they *are* placing their employees at greater risk…..they just *do not care*.",AlabasterOctopus,t2_122j8r,2,0,reddit2
h74e4av,t3_oujqvq,2021-07-30 19:50:41,science,"Wait, so the thing making you miserable is making you miserable?",Frenchleneuf,t2_mq7is,2,0,reddit2
